不用塑身衣反而覺得有問題，大量抽脂沒有不需要的，因為塑身衣的壓迫是有利於癒合過程，而不是技術問題顯微抽得到補胸的量嗎,不推郭,抽脂可考慮威塑,我也有考慮光彩，但鍾馨不用塑身衣也很吸引人希望有諮詢過的可以分享一下><回大是顯微抽脂，說法是不傷害血管所以不需壓迫止血,,,,,,,,,,,,,,,,,,,,,,,,,,,,,,,,,,,,,,,,,,,,,,,,,,,,,,,,,,,,,,,,,,,,,,,,,,,,,,,,,,,,,,,,,,,,,,,,
我喜歡，加上隱形眼線會很好看,除非你都會劃比較認真的眼妝，否則選其實日常淡妝比較有神也有氣質,,我喜歡耶,如果喜歡畫眼妝也常常畫可以，比較自然,開放式雙眼皮長在亞洲人上看起來常常假假的,"若你常帶妝就選若否就選畢竟會有個""折痕""",,,比較好看，會變無神。,我今年一月在新聖割外開我覺得久了會變窄,漂亮,你如果都不開眼頭的話，還是直接縫內雙好了，不然你的內開外開眼頭都會有一層摺痕在那,是說雙眼皮手術應是開放跟半開放外開內開是眼袋手術的進行方式,,要的話要開眼頭吧不然真的蠻怪的不好看，比較好,,謝謝各位醫生也是跟我說外開的摺痕會有點怪恩恩會抽一點點脂肪大家跟醫生一樣都覺得比較好看欸謝謝大家的意見（淚）,，戴放大片比較好看，感覺久了會掉下來或被眼皮吃掉,請問會需要抽脂嗎眼皮感覺蠻厚的,,,,,,,,,,,,,,,,,,,,,,,,,,,,,,,,,,,,,,,,,,,,,,,,,,,,,,,,,,,,,,,,,,,,,,,,,,,,,,,,
推薦歐美診所-歐令奮醫師,,,,,,,,,,,,,,,,,,,,,,,,,,,,,,,,,,,,,,,,,,,,,,,,,,,,,,,,,,,,,,,,,,,,,,,,,,,,,,,,,,,,,,,,,,,,,,,,,,,
凡登還有吳醫師啊人很好很細心,推,我給凡登吳醫師開的，吳醫師技術也不錯,凡登馮醫師很厲害之前給他做的很成功,請問馮院長的報價是,諮詢馮醫師也是不到分鐘結束還付了諮詢費，感覺不是很好,自信的感覺讓我有點怕怕的馮醫師,凡登吳醫師+,推凡登吳+，親切且細心，我是做內開眼袋+自體補脂。可以理解原的忐忑不安，我手術前即便爬很多文做很多功課，還是很擔憂，但當面跟醫師諮詢後，就付訂金及排刀期，不過真的是太擔心了，甚至考慮先準備好自書遺囑或訴訟狀紙(自己嚇自己)。再過兩天就術後滿週，臉沒淤青，可以不戴口罩給妳參考看看。,新聖蕭醫師的話我蠻久蠻久以前有發過眼袋內開心得，你可以去找找看看,給荊醫生做的覺得不錯,我是馮院長開的，我覺得不錯，開完半年,推蕭醫師,皇蘇不錯啊技術很好的醫師，蠻全面性的,覺得諮詢時間完全不是重點耶之前去極諮詢眼睛也是秒殺但醫師的諮詢就有說到我的心坎裏完全點出我在意的問題覺得皇高傲+,推馮醫師,我推雅丰吳醫師眼袋回填淚溝給他做很成攻，也推一下雅丰術後照顧周全的部分,和蕭諮詢的感覺很好專業又很親切,推馮中和他真的厲害,能請問馮醫師內開的報價嗎謝謝,凡登馮開過眼袋，讚,歲就開眼袋，也太早了吧,渾然*成、皇*不錯，可以親自跑一趟看看兩家醫師技術都不賴只是第家醫師高傲點,我給荊醫生做的覺得不錯,,,,,,,,,,,,,,,,,,,,,,,,,,,,,,,,,,,,,,,,,,,,,,,,,,,,,,,,,,,,,,,,,,,,,,,,,,,,
個人蒙古摺第三級只有開眼頭才能把蒙古摺弄掉如果我是你我會選半開放,,喜歡,我會介意摺子所以七年後我又重修了,,我覺得變得比較無神,覺得好看,最好看,的半開放非常好看喜歡,我之前選，結果摺子明顯的非常可怕，一年後立刻找別人重修了,從照片中我覺得開放式那個小摺好明顯，而且很難沒去注意到耶，不知道術後可以減輕到什麼程度，不然我也覺得開放式蠻好看的,好無神耶,,時間久了會掉比較好,老實說的蒙古折滿明顯的耶覺得好看,選自己喜歡的那是你的外觀,選自己喜歡的吧畢竟自己比較常看,楊醫師的建議呢他有說嗎,,絕對選封閉式有時候開放式反而眼睛還比較沒神（沒化妝情況下）但化了妝極美不不你誤會了我是說我會選封閉式以前去用的時候崇尚外雙想讓眼睛看起來大結果反而更小後來還去改成內雙不過適合我這種不常化妝的懶人,我覺得現在最好看欸眼睛最大最有神,我選年前在信望愛縫，時間久了，就變內雙,開放式跟半開方式真的好看很多,好看,開放式，比較顯大顯美,但我覺得開放式遮住比較多黑眼珠看起來比較無神耶,好看,,我就掉不下來超煩,開放式好看摺子上妝就不明顯了,,,,,,,,,,,,,,,,,,,,,,,,,,,,,,,,,,,,,,,,,,,,,,,,,,,,,,,,,,,,,,,,,,,,,,
推瑞絲朗，記得下巴要選中分子，支撐度夠也好雕塑,衣絜汪醫師細心而且幫我把我的短下巴都變好,之前給好萊塢的郭美妤醫師打過下巴，還不錯，打,有朋友是給李杰年用瑞絲朗打下巴跟鼻子我覺得效果也很好自然，一年多都還在,孫孝先鼻子下巴打得不錯,請問在雲林打多少錢呢幾,我跟台北不熟，不過我在雲林的陳佩軍皮膚科診所給院長諮詢，他建議我打瑞絲朗，好雕塑也可以維持比較久，我打完也很滿意撐兩年都還在,推愛力根,郭美妤醫師真的不錯，我在星和給郭治療過，很細心,,,,,,,,,,,,,,,,,,,,,,,,,,,,,,,,,,,,,,,,,,,,,,,,,,,,,,,,,,,,,,,,,,,,,,,,,,,,,,,,,,,,,,,,,,,
眼袋轉移後補玻尿酸有點奇怪，怎麼不補脂肪，第三的六位數也太貴了吧原聽起來應該是很凹，建議找自體脂肪移植不錯的醫師手術，之後才能幫您補好補滿身體再怎麼瘦不會連幾脂肪都沒有同意大，補淚溝才需要-而已，有些誇張了,同意樓上說的再多諮詢其他間吧不過的確還有一個需要顧慮的點啦就是以原的體質就算真的補了脂肪可能也留不住@@,第一家那個皮膚黑是啥,不建議打玻尿酸我先前補淚溝眼打到沒半年就出現硬塊(台中打的)約個月後回台北內開順便把玻尿酸清掉,本人身材和原很像，我去年,我之前做的是內開脂肪回填淚溝，原應該是眼袋的脂肪不夠填淚溝但說真的玻尿酸的異物感還是比較重，所以才都會先建議做脂肪再來才是考慮玻尿酸。之前有過一篇眼袋內開的小心得，雖然沒有做玻尿酸但希望對你有幫助加油,樓上可透露一下在哪打的嗎,有是正常體重範圍，除非體脂低到不可思議，不然還是有大腿脂肪可以抽吧,,,,,,,,,,,,,,,,,,,,,,,,,,,,,,,,,,,,,,,,,,,,,,,,,,,,,,,,,,,,,,,,,,,,,,,,,,,,,,,,,,,,,,,,,,,,
路過偷推一下雷神我的手臂差超多讚,推蔡家碩醫師我抽大腿差很多身邊朋友看`蔡醫師抽腹部效果也很好,有沒有考慮補胸也要計算在內威塑比較好吧抽很多就是好抽脂又不是在比賽誰抽的多,親自去+,推教主吳孟穎醫師之前冬天給他做過威塑抽脂，效果蠻不錯的很滿意而且不收諮詢費你可以先去給醫師做專業評估哦想知道詳細也歡迎私訊我^^,當然是陳教授很實際又真實,謝醫師不錯很認真的醫師不太會推銷妳不適合的項目,覺得還是親自去諮詢感受看看並和醫師討論比較準確,陳術後照顧真的超好,有諮詢過了嗎有時候醫生給你的感覺決定一切,我抽過三次，覺得雷神林最滿意阿不只，該說是遇過三個抽脂醫生,我是給周杰抽的可以我,抽脂的話版上也有人推周杰醫生，評價還不錯，不過建議你，都去諮詢看看，再根據自己的感覺做決定,推馮中和醫師，他們有麻醉醫師團隊合作,推薦陳煥堂教授量大才是王道,如果有預算方面的問題大家會推誰呢,看你要做傳統還是威塑威塑,可以找台北亞緻的王祥亞醫師（水刀）或賴釗毅醫師（威塑）,,,,,,,,,,,,,,,,,,,,,,,,,,,,,,,,,,,,,,,,,,,,,,,,,,,,,,,,,,,,,,,,,,,,,,,,,,,,,,,,,,
什麼縣市為主呢鄭嘉琪醫師還不錯,張光正埋線之神手講師級的呀,美女醫師王彥文,我推群英陳歷舜醫師醫師看起來很年輕(網路上有人稱型男)但是很有經驗,,,,,,,,,,,,,,,,,,,,,,,,,,,,,,,,,,,,,,,,,,,,,,,,,,,,,,,,,,,,,,,,,,,,,,,,,,,,,,,,,,,,,,,,,,,,,,,,
冬天抽脂真的超讚夏天一到朋友還會說減肥成功超爽的我之前是給台北的吳孟穎醫師做威塑抽脂，效果蠻不錯的，你可以去諮詢看看術後我很滿意，但冬天容易吃得多，我還有搭配運動維持身材，到了夏天穿一波比基尼,是,是他封號的簡寫嗎如果是的話我有給`,是嗎,是的,,,,,,,,,,,,,,,,,,,,,,,,,,,,,,,,,,,,,,,,,,,,,,,,,,,,,,,,,,,,,,,,,,,,,,,,,,,,,,,,,,,,,,,,,,,,,,,
喬雅登撐一年半左右，還不錯,樓上每個玻尿酸都不是從動物也有人對喬雅登過敏的喬雅登很好但其他牌安全性都好,我是打喬雅登，通常都可以維持一年多再回去補,聽說喬雅登不是從動物體內萃取玻尿酸安全性比較高,我有打過兩個牌子但後來有繼續在打的是喬雅登打的過程中比較舒適也比較自然,,,,,,,,,,,,,,,,,,,,,,,,,,,,,,,,,,,,,,,,,,,,,,,,,,,,,,,,,,,,,,,,,,,,,,,,,,,,,,,,,,,,,,,,,,,,,,,
我在三重美麗人生做了酷塑，手臂，蠻有感的，有想再去做一次,雷射不是蟹足腫的正規治療吧肥厚性疤痕可考慮蟹足腫不一定冑,,,,,,,,,,,,,,,,,,,,,,,,,,,,,,,,,,,,,,,,,,,,,,,,,,,,,,,,,,,,,,,,,,,,,,,,,,,,,,,,,,,,,,,,,,,,,,,,,,
自體脂肪久了也不會被吃掉存活下來就是自己的脂肪，你自己的脂肪長時間會被吸收嗎脂肪需要一段時間穩定存活，前三個月是關鍵期，但是存活下來的算是自己活生生的組織，所以也不會突然消失（存活率低當然跟很多因素都相關）關鍵非常多喔，抽脂技術，離心純化技術，注入胸部的方式等等，魔鬼藏在細節中,自體脂肪長時間也會被吸收,最近剛做完恢復中，到時再分享,等魔滴,天母徐永康,魔滴價格太不親人了（哭,自體脂肪隆乳我也想過噎但人體會吸收脂肪，光想到要補好多次就覺得累不過材質太多了很難抉擇，直到前幾天去極緻諮詢，張醫生解釋詳各種材質最後我選果凍隆乳就是了去聽聽看啊,魔滴起跳吧反正有錢就衝頂哈哈,我跟原根本能一起去極緻團報哈哈。每次穿平口內衣。前後面都分不清。諮詢到現在最中意張醫師,魔滴感覺至少萬起跳,有聽過做完半年消光光的，因為作息不正常,存活的關鍵是什麼呢作息營養,魔滴真的蠻不錯的現在成功案例越來越多了，是進場的好時機雖然價格高了點，但優點也是不少前陣子才陪朋友去給台北吳孟穎醫師諮詢過，才知道做這個術後可以不用按摩維持胸型，而且看醫師做的案例都很自然漂亮，也不會刻意推銷，有針對客人的狀況做手術建議，真心推薦,張醫師隆乳的案例有垂墜感頗自然不會看起來像兩個大碗公的假奶也在考慮要不要在極緻做,考慮準備去維格做，費用真的不低但這輩子就這對奶了阿,我姐已經預約維格下月做魔滴隆乳了，希望成果美妙,亞緻王祥亞醫師或是賴雅薇醫師,,,,,,,,,,,,,,,,,,,,,,,,,,,,,,,,,,,,,,,,,,,,,,,,,,,,,,,,,,,,,,,,,,,,,,,,,,,,,,,,,,,
,,,,,,,,,,,,,,,,,,,,,,,,,,,,,,,,,,,,,,,,,,,,,,,,,,,,,,,,,,,,,,,,,,,,,,,,,,,,,,,,,,,,,,,,,,,,,,,,,,,
古亭吳孟穎醫師也有做威塑抽脂唷之前閨蜜健身甩肉卡關，就是尋求威塑改善的，給吳醫師做完線條真的變的很好看，效果很不錯推薦給你而且去他們家諮詢不用怕被推銷哦,給悠美劉醫師做很滿意，可以多諮詢幾間,我給東京風采的張大力醫生做大腿環抽，非常漂亮自然，術後照顧很用心。我手臂在別間抽失敗，之後要拜託張醫師幫我重修。,在高雄給周杰抽的（他現在有在台北當時有加補胸效果很好,找對醫生很重要周杰目前也有在極緻身邊有朋友實際找他做威塑恢復狀況良好,凡登馮醫生推一個,台北的吳孟穎醫師也有在做威塑抽脂，威塑比傳統的手術出血量還少，恢復期也比較短，大推之前就給這位醫師抽過大腿，讓我輕鬆大腿縫,極緻周杰,極緻記得還滿多不錯的案例欸我是很心動你也還想要多諮詢幾間嗎,還是推薦到亞緻找賴釗毅醫師,,,,,,,,,,,,,,,,,,,,,,,,,,,,,,,,,,,,,,,,,,,,,,,,,,,,,,,,,,,,,,,,,,,,,,,,,,,,,,,,,,,,,,,,,,
我也是選我是小資族&安全很重要,貴貴，而且好像越來越貴，口袋不深可以選擇其他,我選諮詢時醫師針對我的問題一針見血術後鼻子也很好看有分享過沒選口袋不夠深價格上差不多我是選群英人員親切服務不錯,都不要,術後有問題不滿意，不會推卸責任。只是麻醉費用還是得自己出就是了,想知道不要的理由+,很好啊，只是貴而已,給做非常滿意但是真的貴,貴技術真的強絕對不要,蘇醫師除了群英也有在維格價格有差嗎,為何不要,可以查一查之前的新聞抱歉眼殘哈哈剛剛看到原有提到了我覺得如果有疑慮就不要比較好,推高雄美妍醫美診所賴醫師，我在那邊做注站內信,,,,,,,,,,,,,,,,,,,,,,,,,,,,,,,,,,,,,,,,,,,,,,,,,,,,,,,,,,,,,,,,,,,,,,,,,,,,,,,,,,,,,,,
他重修很痛腫比較久痛很的用他,我能理解你我也一樣想找重修厲,想請問原本的醫生是哪位謝謝,雙眼皮沒做好的心情我懂我已經安排好最近要給極緻的杜醫師做重修,請問原本的醫生是哪位><謝謝,不推沈筠惇心得我可以寄信給你術後閉眼疤痕非常明顯睜眼無神大小眼有回診啊但是個人覺得他技術沒有很好我尊重你的看法只能說我個人不推沈筠惇朋友說屠龍刀割的，整外醫生說傷口處理不好供你參考,推台北睿醫盧醫師雖然價位不低但是真的專業重修醫生又龜毛仔細我幾個朋友都是給他弄,我給樓樓上杜醫生諮詢過，如果有做應該也會找他,推沈筠惇，剛做完三週，心得之後會分享請問樓上術後是否有跟醫師好好再次溝通我覺得沈醫師挺負責的。另外請問你有回診嗎,請問原本的醫生謝謝,我是在儷人重修醫師技術很不錯人也好溝通,,,,,,,,,,,,,,,,,,,,,,,,,,,,,,,,,,,,,,,,,,,,,,,,,,,,,,,,,,,,,,,,,,,,,,,,,,,,,,,,,,,,,,,,,
請問有人給新竹黃政達打過嗎效果是否好呢會不會很快消掉最近也在想要找那位打折但我只打,台北選擇真的比較多建議你可以找用大品牌玻尿酸的診所像我是用水微晶打蘋果肌我就找用海德密絲的診所而且一定要堅持現場拆包裝比較安全,新竹就往北到台北或往南到台中就更多選擇囉,我是在東方八千代打的水微晶離台北車站不遠坐車上來滿方便的他們家就是用樓上說的海德密絲喔而且我原本還沒想到現場拆包裝這件事結果醫生就主動這麼做我覺得整體感受滿好的耶打的效果我也很滿意,,,,,,,,,,,,,,,,,,,,,,,,,,,,,,,,,,,,,,,,,,,,,,,,,,,,,,,,,,,,,,,,,,,,,,,,,,,,,,,,,,,,,,,,,,,,,,,,
鍾是家醫科的,推蕭正偉醫師，你可諮詢看看,周杰怎麼都是同個人在推,雷神是林醫師吧原搞錯了,我也想詢問，我是想抽大腿小腿部分,鍾我去諮詢過是人都蠻好我是可以抽但我姊就是內臟脂肪多就建議先減重也有給我們參考減重門診資訊倒是沒有特別推銷不過我還想多問幾家再來決,推太多反而覺得業配,推極緻周醫師,雷神不是林醫師嗎還是我搞錯了,給賴抽過，他給人很安心的感覺，當初不是做威塑，但效果也好,鐘超貴,推陳煥棠教授,大面積不建議雷溶啦,可以問理由嗎謝謝那你去哪家雷溶呢謝謝,雷神現在是在巴比崙診所，但我推極緻周杰醫師,不推鍾-李醫生去諮詢過，態度很差等了一小時，李醫師只說了五分鐘就要我出來了感覺超差的如過在意塑身衣，雷溶也幾乎不用雷溶只要穿三天塑身衣我是被鍾趕出來之後，跑去雷溶之前也是很心動鍾主打不穿塑身衣結果去諮詢之後最失望的就這家而且鍾會ㄧ直推銷減重門診建議大家還是多諮詢找適合的醫生雷神，醫生很有耐心醫術也很好術後也幾乎沒有瘀青塑身衣只穿三天，隔天就去上班了不過雷神很難預約就是了,,,,,,,,,,,,,,,,,,,,,,,,,,,,,,,,,,,,,,,,,,,,,,,,,,,,,,,,,,,,,,,,,,,,,,,,,,,,,,,,,,,,
沒錢打廣告吧本來就是跟醫生的技術非常有關,推凡登周醫師如果有需要也可以把脂肪補臉補胸我做完效果很好(剛沒推出去,這三家只聽過凡登,周杰一堆人推分享案例好少,請問樓上大大們術後一切正常嗎有看過新聞有人在別家抽成粗細不依的腿唉驚,這版上打手好多,板上好多人推周醫師，但案例真的很少想看自體隆乳分享,我是推薦非凡尚水的朱醫師喔朱醫師價錢不是最低但解說很詳細朱醫師也救了我的一單一雙眼皮如果有空建議原去諮詢看看,也在考慮周，但案例有點少有給他做的可以分享嗎（尤其大腿）,你可以參考我的分享喔,版上是滿多推周杰醫生的不過你覺得那三間都不錯的話就都去諮詢看看，在挑你感覺最好的那間，畢竟每個人的感覺都不一樣，不然版上也蠻多人分享抽脂經驗的，也可以參考看看，再去詢問是哪位醫生，說不定也會有新的選擇，在此給你點小建議。,白璧和凡登我都有去諮詢過最後選白璧凡登是蠻便宜的不過諮詢後較滿意白璧感覺醫生跟機器比較好過程中蠻親切的而且有問有答專業性很夠我一切正常喔抽到現在個多月了沒有鬆而且抽完後大腿中間終於有縫隙了整個感動阿,凡登周杰,,,,,,,,,,,,,,,,,,,,,,,,,,,,,,,,,,,,,,,,,,,,,,,,,,,,,,,,,,,,,,,,,,,,,,,,,,,,,,,,,,,,,,,
趙文琪我舅媽去弄得滿好,一起做感覺會腫很久,杜醫師目前極緻醫美有診,板上應該早就有不少眼睛的分享了吧,大說的那間簡美我有去過很不錯推,杜隆成醫師，朋友雙眼皮是他割的多年了仍舊自然但不確定他現在哪家診所,腫+但痛一次就好也不錯,找眼部專業醫師吧台中群英羅仁傑醫師不錯，我自己是找他手術,你住哪啊頂溪那邊有一間簡Ｘ美還不錯,,,,,,,,,,,,,,,,,,,,,,,,,,,,,,,,,,,,,,,,,,,,,,,,,,,,,,,,,,,,,,,,,,,,,,,,,,,,,,,,,,,,,,,,,,,
我是預計明年月給陳教授抽蝴蝶袖+大腿環抽+胃凸處，價錢真的滿實在的約萬左右，也許等我回來可以跟你分享看看,不就前幾篇大就是周的案例,之前朋友打過消脂針，但後來發現費用累積下來不如做手術，就決定勇敢做了她是給台中的邱智弘醫師抽的，效果很不錯醫師也很細心，你可以去諮詢看看,周也許可以殺價吧可以試試看,推威塑,如果你不急著決定可以等我心得喔，我剛給周抽完一週,推賴醫生三週前才抽，還沒完全消腫但真的細好多,前幾天極緻回診有看到周的介紹要手術的話我推這間環境很好,我喜歡賴,周醫生的案例，我記得前面幾篇有版友推文是選周醫生的，你可以等他的分享，如果他滿意的話啦另外馮的討論度好像也蠻高的。,台中是哪一間啊,想知道+,直接找傳統抽脂陳教授阿量大王道,周、賴、馮都是威塑，各有千秋,如果哪天我要抽，我一定找周杰,版大是諮詢時就全台跑透透了嗎,,,,,,,,,,,,,,,,,,,,,,,,,,,,,,,,,,,,,,,,,,,,,,,,,,,,,,,,,,,,,,,,,,,,,,,,,,,,,,,,,,,,
這間資訊比較多，謝謝推薦,新竹凡登很多人推,,,,,,,,,,,,,,,,,,,,,,,,,,,,,,,,,,,,,,,,,,,,,,,,,,,,,,,,,,,,,,,,,,,,,,,,,,,,,,,,,,,,,,,,,,,,,,,,,,
推薦您雅丰林孟羲醫師，是隆乳的專家，在網路上很多好評可以搜尋，醫師很親切幽默可以先去諮詢看看,我是楊醫師做的，基本上要打電話預約看診就很難了，我術後回診的時候聽到雙眼皮手術要等四個月,我是找元和雅方醫師，但真的要親自諮詢會比較了解自己想要的,我朋友們分別給徐永康和張松源，你可以去他們網站看作品參考我兩個都抓過絨毛面圓盤都蠻自然和軟,新聖蕭奕君+人美技術又好，隆乳我最後還是選女醫師，覺得女醫師比較懂我需求，討論起來也比較自在,是怕很難約聽說都排很滿了生完想用排不到,我是給群英陳醫師做的光滑面,楊國輝不用業配真心推薦,推薦給你台北的吳孟穎醫師，是整形外科專科醫師是水滴型隆乳原廠認證醫師，學經歷很豐富讓人安心他們官網上也有許多術前術後的案例可以做參考，我覺得都很漂亮唷,我是給新聖楊醫生，但是蕭醫生風評也高，目前一年左右，成品很美很常裸體看鏡子楊醫生好像不太打廣告我也是上狂看文和他也是唯一一個敢給我看一堆照片成品的醫生要提前三個月以上預約，我就是太晚預約還排到台中去好險之後台北有人取消立馬搶位子,亞緻王祥亞好像也可以諮詢魔滴,新聖蕭醫師,,,,,,,,,,,,,,,,,,,,,,,,,,,,,,,,,,,,,,,,,,,,,,,,,,,,,,,,,,,,,,,,,,,,,,,,,,,,,,,,,,,,,,,,
台中邱智弘+我自己之前是為了事業線而去教主做魔滴邱醫師跟護士都很專業很細心術後也會關心我的狀況手術價位也蠻的整體值很高你可以去諮詢看看哦,隆乳林鴻祥醫師也,台中首選楊國輝,爬文,林雍球+我自己是在群英做內視鏡水滴果凍醫生跟護士都很專業。,推新聖楊,一定要挑整形外科阿專業又安全米秝琪可以考慮看看,唯一推薦楊國輝不過很貴新聖是楊國輝開的教主是別間,推群英林雍球醫師我做水滴有分享價格跟你抓的差不多,新聖台中教主看過都做得不錯新聖的話費用會稍高一點,請問樓樓上的的教主是指楊國輝嗎,我給何格彰做隆乳已年妹妹也去做,教主諮詢直接面對醫師而且不用諮詢費很佛心,要看你是想做什麼的，如果是自體脂肪隆乳就要看醫師抽脂技術和脂肪存活率，自體脂肪隆乳的話馮中和可以諮詢看看賴釗毅版上也有人推,教主推薦誰我想自體,台中隆乳推薦格嘉何格彰醫師，諮詢不用收費，有模擬。,何格彰醫師很專業，隆乳案例也蠻多的，費,爬文,教主比較有聽過的是邱智弘新聖就楊國輝,台中的邱智弘醫師口碑蠻好的你可以去諮詢看看我朋友之前是給他做魔滴隆乳，效果真的很不錯有結合圓盤型和水滴型的特長，她術後很滿意還拍了手術分享的影片你有興趣的話也可以看他們的官網資訊做參考哦,隆乳是大手術還是親自諮詢才找的到心中理想的胸型,,,,,,,,,,,,,,,,,,,,,,,,,,,,,,,,,,,,,,,,,,,,,,,,,,,,,,,,,,,,,,,,,,,,,,,,,,,,,,,
覺得你可以多諮詢幾家看看我朋友之前給台中邱智弘醫師做魔滴，效果就很不錯雖然是主打自然柔軟但是穿胸罩還是有很深邃的乳溝啊重點是很方便術後不需要按摩維持胸型大推這個醫師,推圓盤我有些比較瘦的朋友在徐永康和美麗新和張松源那做都是圓盤,醫生評估不會亂來畢竟人家的經驗多水滴胸型也美美的不至於不夠爆乳吧,如果我是說如果肚子脂肪很頑固就做自體省得肚子跟胸一樣大因為頑固可以補胸不用錢我本來被洗腦做果凍也不考慮自體脂肪因為移殖後他們還以為是腹部所以還是頑固可以放心不太會吸收我是運動後一年又復胖所以痛下決心要讓脂肪細胞搬家只能說是他們長錯位置胸部才該是他們的家阿給原參考畢竟年長後代謝會差到一定年紀也不適合抽脂脂肪細胞數量成年不增不減曾胖過必復胖小時候胖一生胖才是真理版上會說做果凍的都是瘦子啦小時候瘦瘦的那種我不知道原身材如何只是看到了曾胖過這關鍵詞,扁身還是做水滴的好應該上胸比較自然聽醫師的建議吧水滴還不用按摩,水滴也能圓滿爆乳而且觸感較自然你可以拿想要的胸型照片給醫生看看說不定討論後是用水滴達到你想要的胸,,,,,,,,,,,,,,,,,,,,,,,,,,,,,,,,,,,,,,,,,,,,,,,,,,,,,,,,,,,,,,,,,,,,,,,,,,,,,,,,,,,,,,,,,,,,,,
喬雅登撐很久,喬亞登打了不痛撐很久,,,,,,,,,,,,,,,,,,,,,,,,,,,,,,,,,,,,,,,,,,,,,,,,,,,,,,,,,,,,,,,,,,,,,,,,,,,,,,,,,,,,,,,,,,,,,,,,,,
凡登可以問問看,凡登的可以查我的心得，我的也是蠻嚴重的眼`,我有看到某版友在新聖內開眼袋是舒眠麻醉耶你可以打電話或新聖詢問他們哇謝謝原更新給有需要此資訊的人麻醉好像真的每個人不一樣，我前天在別的診所內開局麻，可以說是完全不痛(除打麻醉針時很痛)但介紹我去的朋友說手術過程她超痛，很可怕原如果過程中開始有些微痛感，就快請醫生補打麻醉吧,新聖可以舒麻吧之前諮詢內開楊醫生也是報舒麻，直接問問看醫師吧,之前有諮詢過新聖蕭醫師，是報舒麻喔,正常自費加錢就能全麻吧,我找楊醫師外開+中臉，是局麻，途中醫師會請你睜開看，雖然痛到爆（真的很煎熬）但很值得哈哈（我是割開眼頭，眼尾就開始有，捕打後弄到眼尾，眼頭開始痛的超快速退麻體質）超級煎熬,記得版上有人分享過黃昱豪眼袋還不錯，有舒麻,,,,,,,,,,,,,,,,,,,,,,,,,,,,,,,,,,,,,,,,,,,,,,,,,,,,,,,,,,,,,,,,,,,,,,,,,,,,,,,,,,,,,,,,,,,,
