周杰吧上次他幫我用脂肪修混血瞳割太深後來有不錯效果,我是給周杰做的，當初傻傻的，也沒去過其他間評估，補額頭鼻樑法令，今天滿個月，效果不錯，但鼻樑的脂肪已消失,想請問原不考慮非凡的原因嗎因為朋友去過也有推薦我，但還沒去諮詢我朋友是說她們解釋蠻清楚的，價格也是分開報讓她自己抉擇，應該是個人喜好問題，我自己也是希望介紹清楚但自己決定，總比做了不是自己想要的才說要用別的方式改善來得好囉不好意思推文亂掉了：（,有諮詢過非凡的蔡醫師，覺得他很親切耶項目報價也很清楚呀,我給凡登洪醫師補的很喜歡,李很低調，你可以詢問診所現場是否有案例參考,李沒有案例可看，我是給李做的,推周杰我們都給他做的很滿意,,,,,,,,,,,,,,,,,,,,,,,,,,,,,,,,,,,,,,,,,,,,,,,,,,,,,,,,,,,,,,,,,,,,,,,,,,,,,,,,,,,,,,,,,,,,
若淚溝沒有很深熊貓針也有填補的效果，看個人體質我是二個月就消光了,我去韓納斯打玻尿酸我覺得技術蠻好的淚溝都不會有毛毛蟲的問題目前都還很滿意,謝謝大分享，我一直以為熊貓針是針對黑眼圈，原來誤會了感謝大回覆，女神動態好貴價格比較親民，不知效果如何，謝謝,以前都用玻尿酸補淚溝不過消失超快的，這次改用熊貓針效果超好，建議整外專科醫生多諮詢但還沒遇到一個完美到讓我推薦的醫師醫師不停的提醒我熊貓針會不如玻尿酸持久結果我自己感覺卻是熊貓針撐的比較久,淚溝推女神動態跟熊貓針,如果不是太凹陷的淚溝的確可以用熊貓針，但如果結構上問題嚴重，還是需要有支撐力的玻尿酸的話，或許可以參考水無痕，它們好像有種改良技術可以避免廷得耳效應(雖然我沒打過，我自己去年是打熊貓針，不過我是黑眼圈問題大於淚溝問題)瑞斯朗的話可以考慮女神動態，凝膠型的對眼周比較友善不過還是要看醫師的技術和經驗，還有對材質的了解另外舒顏萃的話要抓後續生長的量比較難預估，如果淚溝太深或是期望比較高、想很快見效，舒顏萃的效果會稍微比較難一次到位，尤其不能打太淺也比較吃醫師技術如果想選膠原增生的產品，或許可以問問精靈針(至少當下的量會比較好估算)不過說了這麼多好像沒有回覆到原最想知道的問題我對中部醫師不太了解，再請板友幫忙推薦囉說到我剛出社會跑去打人生第一次淚溝就是用它，結果消得滿快的然後那次的醫師就是打出廷得耳喔快兩年都沒有消掉，後來打降解才消掉,我也是去韓娜斯猶豫超久的才做但做完超級滿意,朋友有用水無痕玻尿酸處理淚溝撐半年了還沒消失也沒有出現毛毛蟲,,,,,,,,,,,,,,,,,,,,,,,,,,,,,,,,,,,,,,,,,,,,,,,,,,,,,,,,,,,,,,,,,,,,,,,,,,,,,,,,,,,,,,,,,,,,
不推海德密斯，大概半年就消光了。本來以為是自己問題，但試了其他牌後確實海最快,謝謝您的建議。我再來研究看看。,要不要考慮新的愛霓密絲價格也很親民，是凝膠型的不過也要看原想打什麼部位有認識的朋友打過但不是很推薦,打過和保柔緹，比較喜歡保柔緹打起來比較好看，也比較持久,我用海德密斯打下巴不到三個月就沒了可以看看別的,我覺得也可以去醫美諮詢看看,,,,,,,,,,,,,,,,,,,,,,,,,,,,,,,,,,,,,,,,,,,,,,,,,,,,,,,,,,,,,,,,,,,,,,,,,,,,,,,,,,,,,,,,,,,,,,
彥靓補淚溝大推><只恨沒早點去,推維格洪睿醫師,桃園微整推鄒承軒醫師但什麼時候有看診可能要問問看,我也是桃園鄉親椰我淚溝部分是在搬來台北工作後去給靚優做的推薦給你參考而且桃園跟台北很近拉,,,,,,,,,,,,,,,,,,,,,,,,,,,,,,,,,,,,,,,,,,,,,,,,,,,,,,,,,,,,,,,,,,,,,,,,,,,,,,,,,,,,,,,,,,,,,,,,
我媽眼袋去君做的我個人覺得蠻自然整個人看起來年輕很多可以去問問她們陳醫師多諮詢看看,這兩間我也有諮詢過加上我諮詢過超多家最終是選靚優恢復速度快而且又變有神而且也沒有被發現去動刀ＸＤ,推胡醫師天年假做了眼袋回推過年後還沒被說過看起來很累超開心休天上班還有微微黃霜可蓋掉,我禮拜一剛做完全看不出來，可以站內我,,,,,,,,,,,,,,,,,,,,,,,,,,,,,,,,,,,,,,,,,,,,,,,,,,,,,,,,,,,,,,,,,,,,,,,,,,,,,,,,,,,,,,,,,,,,,,,,
想知道醫生名字感謝,笑的方式，燈的方向，不一樣。,「扎」針,原本法令紋看起來還好耶,不錯耶請問豐唇效果可以維持多久,哪個是@@,,,,,,,,,,,,,,,,,,,,,,,,,,,,,,,,,,,,,,,,,,,,,,,,,,,,,,,,,,,,,,,,,,,,,,,,,,,,,,,,,,,,,,,,,,,,,,
想問大給盧醫師打玻尿酸打哪裡一直給盧醫師看皮膚問題，前不久才聽說醫師是玻尿酸高手,推盧+盧醫師本身也是敏感肌我去看皮膚好幾年了，是因為盧醫師才開始打玻尿酸，打出來自然，邊把關皮膚狀況,皮膚科打玻尿酸盧靜怡吧，診所開很久，玻尿酸二修很有名,我做微整也都是固定找皮膚科，但我住南南港所以都是去優勢，一開始先去看痘痘，現在肉毒皮秒都固定在這邊打，院長技術不錯,幫推，好好奇到底哪家拒接哈哈,回大不用特別說想打哪裡吧應該說該補哪裡這才是醫生的專業吧就是去諮詢和醫師討論看想改善哪裡然後做全臉評估,上個月問玻尿酸下巴被推盧靜怡後來去問完約隔幾天就打了我是周六去補隔天跟朋友去喝下午茶，被問是不是瘦了，臉看起來變小，開心灑花哈哈,,,,,,,,,,,,,,,,,,,,,,,,,,,,,,,,,,,,,,,,,,,,,,,,,,,,,,,,,,,,,,,,,,,,,,,,,,,,,,,,,,,,,,,,,,,,,
推群英洪章桂，用旋轉刀做的比較平，看他們家案例傷口都比別家小，不知道有什麼奧秘,推陳振坤醫師我給他做胸部手術後很滿意耶，看過很多案例覺得他經驗很豐富,我男友之前疑似女乳症給賴醫師追蹤一陣子結果是男友自己太胖==檢查過程蠻仔細的問診也很幽默男生比較不怕尷尬,薇薇醫師在高雄不過是大醫院，又是整外背景,推蘇毓彬他做女乳經驗很多對男生想要的胸型也很瞭,蠻推賴我給他做過隆乳，用的很自然到現在都沒啥問題超滿意，他之前在大醫院當整外主治，記得北部也有診可以預約,其實大醫院整形外科有動胸的大多能掛號去看反正就觸診或是超音波一照就知道了脂肪型女乳乳腺型女乳,推賴雅薇醫師,,,,,,,,,,,,,,,,,,,,,,,,,,,,,,,,,,,,,,,,,,,,,,,,,,,,,,,,,,,,,,,,,,,,,,,,,,,,,,,,,,,,,,,,,,,,
約四年前給荊割的，割完第一次很自然很漂亮，不過半年就掉了，後來又給他補割一次，覺得太深了，一直猶豫要不要找別的醫生重割,荊醫生+縫完很喜歡,我雙眼皮給陳ｘ璋醫師做的耶我也是很推薦ＸＤ,我給第二位做失敗了我走過的坑你不要再走一次,最近剛在璞之妍給林醫師手術（割雙眼皮、提眼肌、開眼頭）林醫師給人的感覺專業細心，也會傾聽你的意見，手術過程很仔細（但也比較花時間）目前術後約兩週都蠻滿意的；之前也去諮詢過荊醫師，感覺其實也很不錯，不過後來林醫師模擬的眼型比較符合需求就沒有找荊醫師手術,我給荊醫生割完沒有明顯的瘀青和腫脹，朋友也說雙眼皮很自然，但如果自己很在意選縫可能比較安心，體質也會影響恢復,首爾吳醫生很多人推他，他做韓式的縫加割(傷口很小)也很自然,我自己是覺得能縫就縫我給林醫師大概一個禮拜就消腫很多了,縫割應該都沒關係我割的也一個禮拜消腫，拆線後朋友看不出來有割雙眼皮的程度，所以看技術,我給林醫師提眼肌（縫）的，術後也恢復得不錯,,,,,,,,,,,,,,,,,,,,,,,,,,,,,,,,,,,,,,,,,,,,,,,,,,,,,,,,,,,,,,,,,,,,,,,,,,,,,,,,,,,,,,,,,,
推周醫生,我是醫美小白諮詢了一堆眼袋手術醫生說我要開眼頭抽眼袋脂肪什麼的聽得我頭昏腦脹最後我是去去首爾醫美做五合一的隱形眼袋手術，因為他們是唯一一家眼部手術全包值有夠高,我上上個禮拜剛給周醫師手術，大概一個禮拜就消腫退瘀青了，我覺得你應該誤會他的意思了，他說的三個月應該是脂肪的穩定期,自體脂肪補淚溝，還是有可能凸唷我姐就,你的醫師也在我的名單內等疫情結束要預約,推欣莘劉醫師做完覺得很值得,醫師指的三個月是補脂肪穩定期，恢復期是-週，我的理解是、穩定後基本上脂肪就不會再被吸收的意思,我推東區的靚優顏醫師欸效果好醫生細心又專業很值得,我作業也在看這兩個都想去諮詢周我有看他的他說的三個月是補脂,想問價格誰高誰低想知道原最後會選擇哪間-,可以請問您周醫生的費用嗎,蕭應該是隆乳比較有名吧,喔喔謝謝,蕭是脂肪轉位填淚溝，周不脂肪轉位直接抽除，自體脂肪補涙溝。我也不知道哪個比較,月份給周醫師手術，目前沒什麼問題個月後就發現很平了，到目前為止三個月，我想應該是沒問題了：）,上禮拜才去欣莘諮詢過診所環境很棒醫生問診時問得很細已經預約了手術時間,路過推周杰醫師，恢復期短，我同事沒發現,可以推薦其他醫生嗎,啊但因為我有補蘋果肌，也有可能腫是因為蘋果肌我不是給周做的，但我是另外抽大腿脂肪哇也是欸我術前完全沒想到還有眼科,我很多朋友眼袋在君做捏做完效果都很好還恢復很快,找眼科醫生開眼袋比去醫美診所來得有保障。,,,,,,,,,,,,,,,,,,,,,,,,,,,,,,,,,,,,,,,,,,,,,,,,,,,,,,,,,,,,,,,,,,,,,,,,,,,,,,,
%也太高，放身體裡面的還是安全為主,,真人胸部偏,柔不可能有光滑軟拉光滑是最軟的材質魔滴的觸感比較像是彈，摸過年輕眉眉的胸就知道了,柔滴不錯，但是供貨不穩定。,絨毛面不軟阿,看滿多人都選擇魔滴的,曼陀水滴不錯呀，而且安全性還有背書,我是選魔滴耶,魔滴手感也不差吧，我自己做就蠻軟的,魔價格確實高但有年保險和年保固安全性上是真的比較有保障畢竟是要長久放在身體裡的東西身體這期間會發生什麼變化很多事難預知,回樓上材質其實差很多數據都很清楚(可能搭順風車,魔滴感覺就像碗粿摸起來彈晃也是整顆移動而已,好奇柔不是和魔一樣都是奈米材質為什麼柔的破裂率就比魔高,光滑真的比較接近真實的胸部，摸完假體後想都不用想直覺選光滑,預算充足做魔滴預算沒那麼多做曼陀的光滑或絨毛,太瘦做光滑容易有水波紋要想清楚,看到版上最近在討論魔滴觸感有人說上胸脂肪不多的人做魔滴會太硬不知道真假我身材偏瘦選光滑比較好嗎,請問曼陀絨毛面呢，到底軟不軟,光滑看到手感立刻就剔除魔滴,我這幾天去君諮詢，想說趁疫情還沒解除在家修復，個人目前是魔跟曼在選，怕痛也為了安全性高應該會選魔,真實的胸部很軟從來沒有彈過,魔滴吧雖然我現在沒要隆乳但不管做什麼都比不上安全更重要,沒人討論柔滴嗎記得它也和魔滴一有保固，而且價格比較便宜，我最近正在觀望,回樓上，破掉的機率%很高耶一個原廠保固，一個代理商保固，不一樣喔,魔滴+補脂最近很流行，軟又自然,,,,,,,,,,,,,,,,,,,,,,,,,,,,,,,,,,,,,,,,,,,,,,,,,,,,,,,,,,,,,,,,,,,,,,,,,,
新聖楊醫生才是正宗喔,雅丰張松源，我給他做二次隆乳你可以我，我之前有發過分享，我重作前胸有水波紋，水滴換魔滴做完觸感蠻的重點有對稱也沒有奇怪的紋路,現在很多間醫美都可以線上諮詢了，才剛問完跟儷人，但我問眼睛路過,楊諮詢完要等三個月才排得到刀很多等不了的都轉去女醫生但我覺得兩個醫生作品風格還是有差異,先線上諮詢看看也省時間，我也在雅丰隆乳，術後還回診按摩跟吃中藥調身體,楊醫生目前不接台中以外的診,推可以去問張松源醫師我覺得張蠻專業講解也很仔細有考量到我的胸廓做出來是我喜歡的大小跟型,,,,,,,,,,,,,,,,,,,,,,,,,,,,,,,,,,,,,,,,,,,,,,,,,,,,,,,,,,,,,,,,,,,,,,,,,,,,,,,,,,,,,,,,,,,,,
請教醫生+謝謝樓主回覆,你好我想詢問費用,,好成功可以詢問費用嗎您好可否請教是哪一位醫生呢真的好成功,,,問題可能不在眼皮，而是額頭皮鬆垮了。可以考慮抬眉或者額頭填充。,,,單看這樣覺得需要抽眼皮脂肪有泡泡眼的感覺,今天縫完了，有在跟醫師現場討論，縫前窄後寬的，縫完沒瘀青，跟我以前在信望愛縫的有差，技術真的好因為我是重逢的，有多加，總共萬新聖楊醫師哦,,,,,,,,,,,,,,,,,,,,,,,,,,,,,,,,,,,,,,,,,,,,,,,,,,,,,,,,,,,,,,,,,,,,,,,,,,,,,,,,,,,,,,,,,
成功路全美開很久了某樓說的似乎是新手,好慘幫台南人,我妹在依Ｘ琦找王醫師割的，原本他想用縫的，但醫生覺得他皮太多叫他用割的我覺得很好看，一週就拆線很自然了,台南沒有名醫建議去外縣市,我給李宗瀚割+提，自然深邃也沒被發現,朋友去過非凡尚水找蔡醫師重修(別家縫結果掉針)，割完變超美，而且很自然,推非凡朱醫師,,,,,,,,,,,,,,,,,,,,,,,,,,,,,,,,,,,,,,,,,,,,,,,,,,,,,,,,,,,,,,,,,,,,,,,,,,,,,,,,,,,,,,,,,,,,,
先去大醫院整外照光或暸解狀況，不嚴重會自然恢復的可以用健保不必自費,去找耳鼻喉科看一下不用找整外，鼻構造專業耳鼻喉還是比整外更強,發問還要版友已經你爬文以前照片，我看你還是別問了*自己,頸對不起，不小心按到手機，囧,林口長庚有整型外傷科,先去醫院看會比較好,題外，妳之前的文都修掉了沒照片呀沒關係啦如果在這邊有人能幫助到妳解決問題比較重要加油@@,了沒照片篇數很多都沒看到,謝謝大家的建議，我先就近找個醫院照一下斷裂狀況。不好意思樓上兩樓，之前因為有同事跟我說會看我發文所以我害羞把照片撤掉了然後很久以前撤掉照片自己都忘了，抱歉現在大家回去找我文章也看不到之前的鼻子謝謝，已經心理建設好最差的結果了，應該會帶媽媽去給醫生拍照說要跟媽媽做一樣，但我會先去照光的，謝謝大家,一定要去看醫生我也是天生挺鼻、偏大，小時候被躲避球砸傷，雖然很痛，但外觀沒有異樣，就放著讓它自己好，長大後一直覺得鼻子微歪(尤其鼻子偏大所以自己覺得滿明顯)。後來遇到專業的醫生，說雖然內傷自己痊癒了，但疤痕組織會攣縮，才會讓鼻子變歪。,,,,,,,,,,,,,,,,,,,,,,,,,,,,,,,,,,,,,,,,,,,,,,,,,,,,,,,,,,,,,,,,,,,,,,,,,,,,,,,,,,,,,,,,,,
,,好看但這篇有幾位是被縫一高一低,話說我就是縫完後蠻明顯一高一低所以有回去補縫就是了,,,,,樓上大那篇剛好我是原,自然不過之後掉下來可能會更窄喔會更自然,,,,,我會覺得你原本的眼睛比較有個人特色,，不要,,你的眼型不適合，、都可,會選,我會選，的話眼角會有摺痕哦(我個人在諮詢的時候是蠻在意眼角摺痕的部分)又再仔細看了一次照片，不確定的眼角是否有兩條摺痕，但還是提醒原注意一下@@,選比較有神,,,原本比較好看，有雙眼皮感覺有點鬥雞眼,,,,,,,,,,,,,,,,,,,,,,,,,,,,,,,,,,,,,,,,,,,,,,,,,,,,,,,,,,,,,,,,,,,,,,,,,,,,
最近真的好常看到柔滴但我還是偏觀望之前看過柔滴的案例不知道是做太大還是怎樣覺得奶底盤很寬看起來很像阿姨個人還是偏好水滴狀的胸型,去君給院長諮詢看看吧我覺得很專業，我自己最後是選了魔,柔滴破裂機率好像偏高欸價格也才差萬安全卻遠比不上魔滴我完全不會考慮,每個人喜歡的不一樣自己摸過比較準,魔滴吧做起來真的很飽滿很好看而且站著時是很自然的水滴型躺平還會往外擴超喜歡我都沒按摩沒特別照顧一樣恢復的好好的懶人可推,觸感真的很主觀，就像有些人覺得魔滴稍硬，但我上次才去診所摸過魔滴，一摸就愛上觸感軟軟很像真實脂肪很對我胃口，光滑太軟了直接被我打槍，之後準備要預約做魔滴,魔滴按摩個人認為是加速軟化不按也沒差,為什麼要追蹤,朋友是在非凡尚水做，效果蠻不錯的，好像也沒有特別按摩，最後的狀況不錯，你可以去諮詢看看,最近一堆分享成功案例，好燒火，我覺得在這邊問不如去跟醫生好好諮詢，畢竟每個人條件不同,目前很多隆乳案例來看還是魔滴的胸型比較美，躺下來時比較不像水滴往外擴散開我是前年找教主邱智弘做，你可以參考看看,最近對隆乳有一定的研究做了很多功課跟和醫生諮詢我個人推薦做魔滴如果皮下組織不是太薄太平的話很多人會因為光滑最軟而去選擇但其實會影響軟度的條件不是單看假體本身而已而且光滑長年下來夾膜重修的機率還是太高了,,,,,,,,,,,,,,,,,,,,,,,,,,,,,,,,,,,,,,,,,,,,,,,,,,,,,,,,,,,,,,,,,,,,,,,,,,,,,,,,,,,,,,,,
元和雅游瑞欽醫師、柯安達醫師,沐妍技術很讚的程以長醫師人非常,當時是去台南找周杰醫師，做到目前相當滿意^_^,沐妍診所推薦程醫師他的技術很好過程都不太會痛我超滿意我術後的樣子,大昌醫院黃昱豪醫師,姚勝發不錯，作了年到現在滿意,高雄首推揚藝美學賴慶鴻,當然是法喬邱醫師,我推熱河診所，做玻尿酸填充效果很推,,,,,,,,,,,,,,,,,,,,,,,,,,,,,,,,,,,,,,,,,,,,,,,,,,,,,,,,,,,,,,,,,,,,,,,,,,,,,,,,,,,,,,,,,,,
不埋線+,侵入式的真的不敢嘗試前陣子看朋友去愛爾打音波，覺得效果不錯，最近疫情緩下來了有點想跟上,我個人蠻推鳳凰電波，但單價比較高，我在打之前也很擔心效果普通錢會不會就放水流，所以是有特別諮詢好幾家，最後是在雅丰給皮膚科醫師打的，諮詢時有很明確點出我皮膚狀況，也針對一些地方建議我特別加強，在發數的控制跟規劃上我覺得蠻仔細，我也按照他們的控制跟規劃上我覺得蠻仔細，我也按照他們的建議去做術後保養，目前維持的狀況還蠻好的,沒打過鳳凰但我覺得埋線效果不錯啊是立即就有感，但真的蠻痛的就是了,我自己也不是埋線派的，不過為什麼原玻尿酸會瘀青這麼久啊@@好奇怪喔然後鳳凰的話比黃金不痛很多很多非常多，如果預算可以的話，我覺得可以直上鳳凰然後我去年是在楊仕安醫師那邊打的，之前有發文過，可以搜尋我的心得。這個月我會再去打第二次,建議打鳳凰鳳凰我是選美之約,請問絕對不埋線派的理由是什麼,絕對不考慮埋線,我推綺的鳳凰，我打發有感,電波才是爆炸痛,,,,,,,,,,,,,,,,,,,,,,,,,,,,,,,,,,,,,,,,,,,,,,,,,,,,,,,,,,,,,,,,,,,,,,,,,,,,,,,,,,,,,,,,,,
在那邊做的覺得手術偏保守,我在君做的，可以找院長諮詢看看，大概兩週我眼睛就很自然了,在高雄嗎可以詢問-家醫師，可能會有不同的見解與施作方式，我是給賴慶鴻做小切口，預算夠可以多比較,推台南文華尚水的朱醫師他的技術很好而且手術完的雙眼皮高度很自然連素顏的時候也不會覺得假假的雙眼皮,,,,,,,,,,,,,,,,,,,,,,,,,,,,,,,,,,,,,,,,,,,,,,,,,,,,,,,,,,,,,,,,,,,,,,,,,,,,,,,,,,,,,,,,,,,,,,,,
最近好像越來越多玻尿酸品牌了,我都打水無痕玻尿酸這牌打起來很自然又不會不舒服,我的淚溝打瑞絲朗,"若是以玻尿酸注射來改善淚溝，一般可以達到成以上的改善幅度，而且立即有效沒有恢復期並且玻尿酸有保水作用，可以幫助淡化黑眼圈但是，玻尿酸注射在淚溝，臨床上是技術難度相當高的位置，建議一定要慎選有經驗的醫師，才能避免""毛毛蟲""的產生，確保注射的安全與效果至於品牌，建議以美國喬雅登及法國瑞絲朗為主，效期最久可長達年",淚溝的話我自己比較推薦打保柔緹不會產生毛毛蟲,熊貓針推打一針抵過一堆眼霜,玻尿酸對鼻子過敏揉眼睛造成的黑眼圈有效果嗎感謝大的回覆，一直打熊貓針感覺會很傷荷包啊（泣,看是哪一種類型，如果只是因為組織流失所導致的凹陷陰影，偏向結構型的黑眼圈，那麼填補之後可以達到一定程度的改善。水無痕玻尿酸可以，預算不夠的話也可以找同樣是凝膠式的愛霓密斯。但如果黑眼圈是色素型或是過敏導致的血管型黑眼圈，則可以參考膠原蛋白(熊貓針)，這幾個價格都還算親民只可惜打完熊貓針要跟玻尿酸隔一段時間，不然我都想打熊貓針的話就是一個養膚的概念，它算是定位比較特別的微整產品,雖然玻尿酸算是小醫美但是你除了考量品牌另外醫生的經驗跟技術也是該注意的重點,可以先去諮詢\聽完醫生建議再選擇品牌畢竟每個人狀況不同,打過喬雅登跟水無痕，比較喜歡水無痕,,,,,,,,,,,,,,,,,,,,,,,,,,,,,,,,,,,,,,,,,,,,,,,,,,,,,,,,,,,,,,,,,,,,,,,,,,,,,,,,,,,,,,,,,
你還可以再多諮詢幾位看看,同推大說的吳思衛，但我是預約他在首爾醫美的門診,我自己是朋友手術完很喜歡推我去諮詢，中山區極張醫師，諮詢的時候感覺醫師懂我在意的點，也有提出建議給我參考，再看看案例覺得就付訂金，做決定需要一些衝動,星采推吳思衛醫生給他縫過幾乎無痕很漂,手術內容一樣的情況下我會依照感覺選醫師基本上我只會諮詢擅長雙眼皮的醫師所以這兩位我不會是我諮詢的選項晶華美醫可以諮詢陳瑋農醫師他擅長雙眼皮,楊國輝這麼有名且案例很多怎麼不考慮,為何特別找網路案例不多的醫生,推薦張醫生我月中才給張醫生做縫雙眼皮，,,,,,,,,,,,,,,,,,,,,,,,,,,,,,,,,,,,,,,,,,,,,,,,,,,,,,,,,,,,,,,,,,,,,,,,,,,,,,,,,,,,,,,,,,,,,
推黃仁吳,給杜提眼肌不得不推長庚出來的老醫生經驗真的很穩後來姐妹也找他做眼袋手術,黃仁吳雖然嚴肅但技術真的不錯，而且他之前是醫院的整形外科主治醫生，我媽眼袋就是給他做的,推極緻杜隆成老醫生技術穩我內開請手術當天跟隔天加假日兩天休禮拜一回去上班諮詢我問小姐幫我約下班時段就沒特別請假,我是在君給蔡昀醫師做的耶我覺得很好阿可以去做，後悔沒早點做，現在看起來年輕超多,朋友眼袋也給林敬均做的真的不錯不然也可以先去諮詢再說*鈞,巨星林之前在板上有分享文很成功我之前看到也超生火的而且他待過長庚欸,我也推黃，嚴肅我覺得還好我是覺得很認真哈哈，真要說缺點就是我那時回診的時候人滿多的要等一下，現在疫情關係不太確定還是不是,可以不用舒眠麻醉，局麻就可以做了黃仁吳印象中是陽明醫學系+北榮出身的，之前有諮詢過他,我知道局麻就可以喔以前做雙眼皮局麻我已經緊張要死，若是開眼袋我應該會嚇到昏過去，所以希望以舒眠為主：）,推李台生簡單迅速有效不痛午休去做立刻回去上班都不會有人發現,,,,,,,,,,,,,,,,,,,,,,,,,,,,,,,,,,,,,,,,,,,,,,,,,,,,,,,,,,,,,,,,,,,,,,,,,,,,,,,,,,,,,,,,,
推薦美塑館，抽的很漂亮,沒有做過這個，不過曾去雅典娜諮詢過別的，醫生電腦裡有很多案例給看，感覺不錯,推周醫師,真心推薦周醫師,大推蘇毓彬醫師腰部跟腹部雕得超讓我滿意,原問的這三個醫生，我在今年五月都有去諮詢過大腿環抽，但我最後是去台北找雷神抽了,大大推君蘇彬醫師，技術真的讚啦,周杰很讚,推高雄大同醫院的賴醫師,台南真的很推非凡尚水朱醫生,南部真的好少喔,,,,,,,,,,,,,,,,,,,,,,,,,,,,,,,,,,,,,,,,,,,,,,,,,,,,,,,,,,,,,,,,,,,,,,,,,,,,,,,,,,,,,,,,,
