醫師跟診所都很重要乳暈切口我推雅丰張松源醫師算是乳暈的權威醫生諮詢可以多看醫師案例評估是不是自己喜歡的,乳暈疤痕明顯，亞洲人唯一推薦腋下,目前台北亞緻我諮詢過環境最舒適，我是想做自體隆乳，諮詢賴醫師很，就像聊天一樣互動,推君綺蔡昀達醫生。需要注意的除了醫生的技術之外，還有是否有專業麻醉醫生，當然術後的人員關心都要很注意，以免有問題找不到人問。,雅丰你可以問問看，東區很多醫美診所我那時候幾乎諮詢完一輪吧，最後是選雅丰。緻美、嘉仕美、巨星、亞緻、極緻還有兩間我忘了，滿意阿，就也因為有諮詢很多間自己也比較知道什麼才是我要的雅丰認真推欸。,醫生跟診所我都會納入考量，醫生技術再好診所手術室的設備不足也很容易造成瘦失敗諮詢上就是多問吧，然後也可以準備一些照片讓醫生更好了解妳想要什麼，我隆乳前至少諮詢過間以上的醫美才決定的,會挑醫師，建議用內視鏡手術的醫師傷口小，從腋下傷口不明顯。診所評估設備及服務。台北推聖緹雅王醫師。,診所很重要但開刀的還是醫生醫生技術也需要選一下診所術後有沒有繼續關心跟照顧會影響修復的心情跟速度還有有沒有提供像是修護點滴這些的也可以留意,我是給張峯瑞醫師做的，疤痕很不明顯醫師技術最重要，所以會先挑醫師,我自己會選擇有經驗和專業感的醫生啦診所應該要看它們的設備和麻醉安全好的醫生應該不會在很奇怪的診所吧之前我找陳坤醫師諮詢，光疤痕要開哪裡，就討論很久了，還好有穿戴和模擬，讓我安心不少,推薦腋下，然後確認是否有麻醉醫師,可以先爬文看看你鎖定的診所醫師評價建議找隆乳領域經驗比較多的雅丰的隆乳術前有電腦模擬跟內衣穿戴術後我有做高壓氧跟中醫調理認真覺得恢復得比我想像的還快跟好,,,,,,,,,,,,,,,,,,,,,,,,,,,,,,,,,,,,,,,,,,,,,,,,,,,,,,,,,,,,,,,,,,,,,,,,,,,,,,,,,,,,,,,,
鳳山美妍醫美，整外團隊跟醫生都很細心,高雄選擇就夠多了,首選曼陀，值高,我是給峻美診所的吳醫師做曼陀，真的很自然觸感又軟，吳醫師人超有趣的，醫術也很精湛，我蠻推的,我是在高雄群給姚勝發醫師做曼陀光滑面，觸感柔軟價格比魔滴低很多,高雄推張智皓醫師,曼陀跟魔滴的觸感不一樣唷建議可以多確認一下自己想要的然後去多諮詢幾間,曼陀有美國認證比較有保障吧,原是想做絨毛還是光滑絨毛觸感比較硬我在意術後自然度所以選魔滴術後莢膜最薄觸感比較自然又軟重點還有保固跟保險,高雄推薦揚藝美學賴慶鴻做很多曼陀,賴雅薇醫師及黃昱豪醫師也不錯,推頤森的黃昱豪醫師，可以參考柔滴,,,,,,,,,,,,,,,,,,,,,,,,,,,,,,,,,,,,,,,,,,,,,,,,,,,,,,,,,,,,,,,,,,,,,,,,,,,,,,,,,,,,,,,,
都可以耶,,,,,,,,,,,,,,,,,,,,,,,,,,,,,,,,,,,,,,,,,,,,,,,,,,,,,,,,,,,,,,,,,,,,,,,,,,,,,,,,,,,,,,,,,,,,,,,,,,,
推玉貴人王技術不錯醫師有耐心,推非凡很專業打得好很值得我給女醫生,,,,,,,,,,,,,,,,,,,,,,,,,,,,,,,,,,,,,,,,,,,,,,,,,,,,,,,,,,,,,,,,,,,,,,,,,,,,,,,,,,,,,,,,,,,,,,,,,,
據說消脂針不太合法遊走法律邊緣的東西建議不要碰到時候出事就,用威塑抽脂直接抽掉比較快看到效果，找吳孟穎醫師順修後下半身看起來有變均勻,這兩個能夠達到的效果不能比吧當然抽脂,建議不要碰危險邊緣的,大範圍的部位打消脂針效果幾乎看不見,在看到的消脂針案例都是下巴欸馬鞍肉不適合吧,馬鞍肉真的是女生的夢魘，完全穿不了緊身牛仔褲，屁股看起來超大＝＝,我雙下巴打幾次消脂針都覺得效果普最後直接去美麗線抽消脂針打馬鞍範圍太大杯水車薪而且要多次錢換算下來直接抽快又效果好,消脂針需要蠻多次療程的而且效果也見仁見智諮詢過嬌點張禮財醫生後我就果斷選了抽脂相較消脂針花的時間少效果也很穩定再私心推薦一下張醫生專業又有耐心,消脂針不建議，你若是怕抽脂動刀，其實找可以信賴的醫師就好囉，我姊也是找樓上大說的張醫師，她是抽手臂，好像蠻順利的,效果要好還是抽脂,做這種辦公室的工作就是要拿空閒的時間來運動我連公司的零食櫃都不太敢碰,大部位的話比較建議直接抽脂消脂針有點花時間而且效果也不太好,瘦瘦筆,反推消脂針朋友打完皮下摸起來有結塊,抽脂,,,,,,,,,,,,,,,,,,,,,,,,,,,,,,,,,,,,,,,,,,,,,,,,,,,,,,,,,,,,,,,,,,,,,,,,,,,,,,,,,,,,
我夫妻宮當初考慮玻尿酸跟晶亮瓷，後來打晶亮瓷，支撐性滿好的，完全不後悔,我是打水無痕，維持度蠻好的，版主也可考慮,我朋友是去聖宜打的，馬上看起來變好,打夫妻宮的話瑞絲朗很我也是補這裡做完快一年了還是非常滿意臉部線條變得很順看起來人柔和了很多,我是打瑞絲朗它比較不會過敏支持度、立體感也很滿意,我是鼻子下巴太陽穴都打瑞絲朗覺得效果很棒很支撐整個臉有澎起來看起來比較年輕,瑞絲朗身邊有一個朋友是打太陽穴附近，效果看上去自然的，臉有比較豐盈但不會凸凸的沒記錯的話好像前幾個月有看到大在問水無痕打淚溝是最近去打了嗎,,,,,,,,,,,,,,,,,,,,,,,,,,,,,,,,,,,,,,,,,,,,,,,,,,,,,,,,,,,,,,,,,,,,,,,,,,,,,,,,,,,,,,,,,,,,,
好多人法令紋打玻尿酸喔，但我是打晶亮瓷，相較之下沒有位移問題，維持度比較好,我是打緹奧希隱型玻尿酸專打法令紋我在韓娜斯二館打的,也可以打立線音波，拉起來,醫師技術一定是有差的啦再來我覺得品牌也很重要我打保柔緹覺得很不錯有跟皮膚融合在一起的感覺所以嘴巴動的時候玻尿酸也不會跑掉而且也不會常常腫起來,如果法令紋要打玻尿酸，也可以試試緹奧希隱形玻尿酸不然異體真皮粉也可以問問看,哪個醫師、打哪牌子我覺得都要注意一下。醫師技術好比較不會打錯位子，像法令紋是屬於動態紋路，打的話要選拉伸力比較好的玻尿酸，之後做表情才不會有異物感。我是比較之後打了女神動態玻尿酸，效果還蠻滿意的，微笑時不會有卡住的感覺,醫生技術真的很重要推薦你可以去君諮詢王樹偉醫生，打微整很專業。我之前是找他打動態玻尿酸，延展性比較好喔,,,,,,,,,,,,,,,,,,,,,,,,,,,,,,,,,,,,,,,,,,,,,,,,,,,,,,,,,,,,,,,,,,,,,,,,,,,,,,,,,,,,,,,,,,,,,
我休養天，放胸大肌下前天比較不舒服傷口在腋下比較不明顯，隆乳沒有想像可怕醫師經驗也有關係，可以多問幾家再決定我是給聖緹雅王醫師手術,隆乳的醫師我多分享一位佳優的黃院長，黃院長溝通不敷衍講得很仔細，我朋友是開腋下傷口不太明顯，術後也不需要引流管恢復的很快，型也蠻自然的,群英的醫師感覺都不錯耶可以感受到對安全的重視我自己給陳廣得醫師後來才知道朋友給陳大正醫師做說也是非常細心我做複合式休息三天、有用引流管疼痛應該與位置有關不過我很不痛無法提供差異我和朋友都是做腋下切口唷,腋下+朋友給王做魔滴很滿意,諮詢時好的醫師會教你怎麼評估我是從腋下現在完全找不到疤痕,,,,,,,,,,,,,,,,,,,,,,,,,,,,,,,,,,,,,,,,,,,,,,,,,,,,,,,,,,,,,,,,,,,,,,,,,,,,,,,,,,,,,,,,,,,,,,,
你有去諮詢過了嗎感覺可以直接去最直接直接諮詢感受看看我也很在意術後有沒有好好照顧,也在做功課階段想借樓問雅丰有推哪位醫師嗎,雅丰我覺得推剛做完回診醫師態度是好的也真的有你說的那些術後照顧還有中醫調理胸型是我喜歡的自然款雖然做完好一陣子了服務應該沒變吧我做魔滴乳暈切口傷口都看不到而且乳頭也沒有不敏感認真推做乳暈欸重點胸型我覺得蠻自然的不會開開的,,,,,,,,,,,,,,,,,,,,,,,,,,,,,,,,,,,,,,,,,,,,,,,,,,,,,,,,,,,,,,,,,,,,,,,,,,,,,,,,,,,,,,,,,,,,,,,,,
我是給雅丰的陳承謙醫師做雙眼皮當初也是傾向縫但也考慮之後可能會有掉下來的問題不想重新用就選割+取脂了醫師真的人超好也很細心再加上診所也有提供術後修復的藥品後來就直接在雅丰做了術後疤痕的話我覺得我還能接受目前化妝也都不太明顯,我割雙眼皮疤痕超不明顯去做臉美容師也沒發現疤痕,給張醫師做的到現在都還沒掉很,推薦當中有一位是大雷，很恐怖爬文會看到相關資訊,我給荊偉政醫生割的因為我的眼皮脂肪比較多適合用割的不過我有朋友給他縫六年都沒掉給你參考我當初是自己準備好問題狂問醫生有問必答讓我覺得很專業也很放心眼袋的部分我覺得好像可以做耶但如果是過敏性眼袋會不會手術完又復發這可能要事先了解,提眼肌無力可以在諮詢杜隆成醫師我是找我找很多間也是叫我用割剪眼皮的但我最後決定用縫的,我是年給張至德醫生做，目前一樣維持的很好,我是給陳承謙醫師做的醫師很細心又很有美感給的建議都非常中肯也很尊重我的,覺得荊醫生冷漠+，諮詢也有點隨便,,,,,,,,,,,,,,,,,,,,,,,,,,,,,,,,,,,,,,,,,,,,,,,,,,,,,,,,,,,,,,,,,,,,,,,,,,,,,,,,,,,,,,,,,,,
粹究等到五月整個紅起來了喔,差到萬我會願意等耶玻尿酸也不是永久的,絕對不行啥年代了還在胰島素空針打不知道啥鬼東,反正幾個月會消，可以先給彥靓黃醫生打，我在哪邊打好幾次，技術不用懷疑,水無痕眼周我推楊仕安醫師，但要提早預約或是排候補(感覺他好像沒有很想賺錢，診次沒有很多),朋友給楊醫師打，看起來真的蠻讚，原本也想馬上衝了，真的不好約到哈,推薦聖的翁醫師,有朋友給打過真的技術很好而且很熱門的樣子所以才要等，好東西值得等話說玻尿酸原來價差也頗大的,剛給打完第二次去依然對醫生的手藝感到佩服之前等不及在別家打效果真的有差另外不推真的母湯,,,,,,,,,,,,,,,,,,,,,,,,,,,,,,,,,,,,,,,,,,,,,,,,,,,,,,,,,,,,,,,,,,,,,,,,,,,,,,,,,,,,,,,,,,,
我朋友是在聖，忘記哪個醫生，也滿美,推台北晶盧勳醫師,所以埋線真的不會很痛嗎這陣子狂被埋線燒到但超級怕痛欸,推夏爾去年底被廣告燒到去找林醫生，我埋了條，做完效果真的超好，臉起來變小超多，過年每個親戚都問我是不是瘦了,拉提類的療程要有效好像難免會痛我這幾年固定在夏爾做埋線找醫師技術好的埋可以少受點皮肉痛哈哈,前陣子版上那篇效果超好的埋線爆文是在夏爾做的我寄站內信問完原就約時間去做了還算在恢復期但效果已經慢慢出來,夏爾今天去了根本沒有醫生出來諮詢,剛問過最後選因為醫師諮詢的時候講解更仔細，而且諮詢師不會過度推銷，約好下周過去做，超級期待效果,好多林醫師哈哈我也是都看到做鼻雕比較多但好像醫師都不一樣,,,,,,,,,,,,,,,,,,,,,,,,,,,,,,,,,,,,,,,,,,,,,,,,,,,,,,,,,,,,,,,,,,,,,,,,,,,,,,,,,,,,,,,,,,,
我朋友給張峯瑞做柔滴胸部很自然，豐滿但不會假，她穿衣服變得很有自信桃花還變多勒,我是給聖緹雅王醫師手術，傷口在腋下不明顯，我沒有擦除疤藥膏，疤痕會慢慢變淡補脂的傷口很小幾乎看不到,考慮曼陀嗎選擇比較多也幾乎不太需要補脂比較自然也比較安全,我找台北亞緻王醫師重建柔滴，本來是做光滑面莢膜攣縮整個胸硬到推不動，很怕再重建失敗諮詢王醫師鼓勵我重做了柔滴讓我又重拾信心開在腋下傷口很小很小，復原狀況很好,我給張峯瑞醫師做很滿意我的切口在乳暈邊緣，術後疤痕滿小的也有擦除疤膏，所以疤痕很不明顯，補脂的地方是注射的針孔應該不算是傷口，疤痕處理應該在於醫師技術,凝膠有用啊我之前做的時候傷口就不大除疤擦玻麗舒的凝膠很快就乾所以穿內衣衣服比較不怕碰到,推張峯瑞醫師，選個技術好的醫師再用除疤凝膠，疤痕就不明顯了,,,,,,,,,,,,,,,,,,,,,,,,,,,,,,,,,,,,,,,,,,,,,,,,,,,,,,,,,,,,,,,,,,,,,,,,,,,,,,,,,,,,,,,,,,,,,
請問汽化雷射是李台生做的嗎我也有觀望這家，請問做汽化眼袋一定要補脂嗎,,,,,,,,,,,,,,,,,,,,,,,,,,,,,,,,,,,,,,,,,,,,,,,,,,,,,,,,,,,,,,,,,,,,,,,,,,,,,,,,,,,,,,,,,,,,,,,,,,,
今天剛去給黃醫師做五合一隱痕眼袋手術麻醉退了完全不會痛，因為我是比較容易瘀青的人眼下有瘀青跟腫而已，而且黃醫師很親切，我沒有補脂，因為我眼下還有之前打的玻尿酸，醫生建議等之後看怎麼在考慮，以上給妳參考，下圖是今天術後的照片,推推黃醫師，超快好,想知道+上個月剛去諮詢錢醫師眼袋內開醫師眼袋內開案例蠻多的我問很多問題也都很有耐心回答我雖然還沒決定要去哪間手術但對錢醫師印象滿好的,有朋友給錢逸群做眼袋內開轉位蘋果肌順便補脂做完整個臉型變順很多,剛給黃醫師做完，復原期出乎意料的沒有復原期,推薦徐典雄醫生我處理眼袋跟頰溝，目前兩年了還是很完美，以前看不太到的小臥蠶都跑出來了,我是遺傳從小就被眼袋纏身淚溝也超深哭哭最近在想要去打玻尿酸還是要手術,我給錢逸群醫師做過眼袋內開因為我淚溝頗深醫師幫我把眼袋脂肪移到淚溝凹陷的地方術後眼下平整很多終於不會一直被別人問是不是沒睡飽了哈哈哈我手術跟術後都沒什麼痛感欸哈哈哈瘀青約個多星期就消掉了,可以@我看好姐妹給蘇瑋智醫師做的手術效果，我最近也心動要做了,蘇嗯,推薦聖陳世翰醫師,眼袋手術我推薦君綺的蔡昀達喔術後大概一週就恢復得很好，跟術前真的差很多,眼袋還是會建議手術直接一勞永逸不然玻尿酸還要一直補打效果也沒有手術來得好,推聯合整形外科林之昀醫師，我是內開眼袋抽脂補淚溝。建議可以先去諮詢，醫師很親切。建議大可以直接手術（真的看起來會有精神很多）；可以多去諮詢幾家，一定可以找到合適的醫生。,,,,,,,,,,,,,,,,,,,,,,,,,,,,,,,,,,,,,,,,,,,,,,,,,,,,,,,,,,,,,,,,,,,,,,,,,,,,,,,,,,,,,,
自費的十萬左右都合理吧。比較怕的是沒做好，要再做一次，再痛一次。不過價格也不代表一切，第二次找有健保的，效果很滿意。,我在士林晶×給陳醫生做，效果很好，之前有分享過，費用的話我有申請保險有給付ㄛ,我比較重視醫師經驗，之前看網路照片有些手術後傷口凹凸很不美觀，我是給蘇毓彬醫師手術，手術可以申請保險自己付幾萬塊，現在穿衣服不用再遮掩胸部夏天真的差很多,之前爬文看到的台南找洪敏翔高雄找賴雅薇都有官方可以詢問,如果不嫌棄台中遠，推薦中山醫大附醫乳房外科的廖啟佑醫師，在粉專看到男性女乳的術前後照效果很好,我在台中手術的有包麻醉跟塑身衣，費用蠻合理沒有很貴，醫師專業手術後退麻時有來關心我，推邱智弘醫師，他諮詢不收費也可以問看看,群英診所的蘇毓彬，專業是一定的+術前術後都很有耐心解答我前年做的全包,,,,,,,,,,,,,,,,,,,,,,,,,,,,,,,,,,,,,,,,,,,,,,,,,,,,,,,,,,,,,,,,,,,,,,,,,,,,,,,,,,,,,,,,,,,,,
給美麗線黃婉茹醫師做過埋線效果超好做完法令紋改善很多,莎斐爾的謝醫師海芙和魚骨埋線有母親節優惠喔看粉絲團案例很吸引人,推薦北市威尼斯診所打海芙跟埋線效果都很棒,過年那時候在台北君綺做海芙，臉有拉提，雙下巴也收進去了。,永和奧蕾莉可諮詢看看,,,,,,,,,,,,,,,,,,,,,,,,,,,,,,,,,,,,,,,,,,,,,,,,,,,,,,,,,,,,,,,,,,,,,,,,,,,,,,,,,,,,,,,,,,,,,,,
賴雅薇醫師不錯,高雄女醫師就賴雅薇吧資歷跟案例都還不錯去她官網看阿我覺得他照都很寫實沒有修圖的感覺滿有參考價值的不然可以去諮詢一下直接去問更準,賴醫師下&外胸緣都做得很不錯,,,,,,,,,,,,,,,,,,,,,,,,,,,,,,,,,,,,,,,,,,,,,,,,,,,,,,,,,,,,,,,,,,,,,,,,,,,,,,,,,,,,,,,,,,,,,,,,,
謝謝樓上大大們分享診所醫師剛看佳母親節優惠最便宜一條蠻心動的,我問過兩三間短線一條,在美麗線做過鈴鐺混神力拉提埋完立刻有感推黃婉茹,一條內君綺，方醫生做超好,覺得做神力拉提一樣要找專門在臉部手術的醫師做比較保險就算線材是目前來說相對安全的還是要慎選醫師不然真的不敢做,神力拉提推薦聖陳醫生,魚骨線線材最粗，拉提效果最好的。醫生說可以用來做基礎打底，然後再搭配其他線材或電音波。看你自己臉的下垂程度再跟醫生討論目前我姐拉魚骨線快一年了還維持的不錯喔,我是兩邊各埋四條效果很好，正面臉很側面下顎線也很緊實，條千有找我也是觀望很久，最後是給蕭弘道埋線他拉皮挺有名，諮詢的時候跟其他醫師的專業度真的有差，所以就很放心找他做了,我自己是在美美上美密特神力線，拉力跟效果都還不錯，很推。,請問是在佳飛雅嗎之前也有朋友在這家做過水光槍說是找一個陳醫師,,,,,,,,,,,,,,,,,,,,,,,,,,,,,,,,,,,,,,,,,,,,,,,,,,,,,,,,,,,,,,,,,,,,,,,,,,,,,,,,,,,,,,,,,,
我是給楊醫生做的，兩年了，很喜歡,推楊醫生,楊醫生你就跟他說你想排候補有人臨時取消你就有機會,我也是大概五六年前給鐘醫師弄的，不過我當初是割的，不知道現在有沒有漲價（目前狀況都維持得很好強烈建議有預算的話可以用割的還不怕掉,投第一家的模擬,諮詢多家的過來人建議：選擇喜歡的那家，我的也是等比較久、比較貴的，但自己看喜歡、等待時間就很值得,我在儷人縫了六年，到這個月才去廖醫師那邊重新縫，如果要說容易掉的話我這邊覺得還好，廖醫生這次縫的我也很滿意建議你可以去諮詢看看唷,楊醫生身邊朋友去用雙眼皮都說值得,,,,,,,,,,,,,,,,,,,,,,,,,,,,,,,,,,,,,,,,,,,,,,,,,,,,,,,,,,,,,,,,,,,,,,,,,,,,,,,,,,,,,,,,,,,,
推張至德醫師很溫柔也很細心,推儷人我在那邊縫效果真的很自然術後看起來超不腫目前縫完快六年都沒掉,推廖家慶醫師，非常細心、恢復期也短，縫完不太腫，身邊人看到都非常稱讚,推張峯瑞醫生很厲害手術真的不痛也很仔細會再三認兩眼高度給他做很滿意,林宣君醫生,,,,,,,,,,,,,,,,,,,,,,,,,,,,,,,,,,,,,,,,,,,,,,,,,,,,,,,,,,,,,,,,,,,,,,,,,,,,,,,,,,,,,,,,,,,,,,,
莎斐爾的謝宇豪院長,沒隆乳過但認同花大錢不要看臉色,吳孟穎醫師不錯，隆乳時會補點脂防胸型看起來更自然，隆乳經驗足夠,亞緻王醫師很不錯，診所有專業的麻醉師,如果還沒有決定，台北聖緹雅王穎醫師有很多案例也很好溝通，諮詢不用費用,美渥診所的呂佾欣醫師,美麗線李岳樺抽補脂手術出名本人親切,如一蕭。亞緻王，邱。凡登吳,是想做假體+補脂嗎,楊國輝吳至偉黃昱豪都還不錯,美渥呂醫師,黃昱豪不錯本人跟診所都蠻親切,亞Ｘ的王醫師,,,,,,,,,,,,,,,,,,,,,,,,,,,,,,,,,,,,,,,,,,,,,,,,,,,,,,,,,,,,,,,,,,,,,,,,,,,,,,,,,,,,,,,
去年在美麗線找馮做淚溝補脂+補蘋果肌院長技術很棒大概兩週消腫,推薦給君綺的廖峻毅醫師做看看喔他眼周眼睛的手術都非常專業。之前媽媽推薦給君綺的廖峻毅醫師做看看喔他眼周眼睛的手術都非常專業。之前媽媽給他弄過眼袋，現在年輕很多。前一則不知道怎麼回事沒傳成功,,,,,,,,,,,,,,,,,,,,,,,,,,,,,,,,,,,,,,,,,,,,,,,,,,,,,,,,,,,,,,,,,,,,,,,,,,,,,,,,,,,,,,,,,,,,,,,,,,
過渡期撐過了就海闊天空,我滿喜歡君的王樹偉醫生的，他很有醫德，做的比較走自然的路線，適合亞洲人的眼睛可以去諮詢看看,附上的照片在看到了天生母胎單雙眼皮,,,,,,,,,,,,,,,,,,,,,,,,,,,,,,,,,,,,,,,,,,,,,,,,,,,,,,,,,,,,,,,,,,,,,,,,,,,,,,,,,,,,,,,,,,,,,,,,,
魔滴推雅丰診所做完有垂墜感觸感摸起來是自然的躺平會自然擺動,魔滴跟柔滴我覺得都不錯，柔滴觸感比較軟，魔滴比較但保固條件好，因為預算跟觸感考量，我後來是選擇柔滴，今年初給黃仁吳醫師做柔滴高凸，要滿半年才不用回診，不過目前一切都不錯，型也蠻自然,選手內推雅丰，我開乳暈疤痕幾乎看看不見，術前電腦模擬我覺得也很重要，術後個人覺得沒什麼落差,可以都去諮詢看看或是魔滴柔滴都摸摸看觸感很主觀，而且也要看妳的身材條件才好做判斷,我是做柔滴隆乳，術後胸部摸起來很軟喔，邱醫師有用內視鏡手術，腋下疤痕不明顯，台中邱智弘醫師隆乳也做很好,,,,,,,,,,,,,,,,,,,,,,,,,,,,,,,,,,,,,,,,,,,,,,,,,,,,,,,,,,,,,,,,,,,,,,,,,,,,,,,,,,,,,,,,,,,,,,,
我是做肌力塑(德國機)幫助增肌超有感肚子馬甲線變更明顯後來我還做了大腿來增強肌力，現在跑步也比較不容易腿痠了,牌是復健科在用的，牌牌就比較是正規增肌儀器。牌收縮力道強，偶爾會到痛，也比較貴。牌就相較溫和便宜,朋友在熱河診所做過，效果還不錯；據她形容第一次打完隔天肌肉感覺有點痠，其他好像沒什麼副作用,如果只是要腹肌就減脂+練核心就好吧,我是去做牌，非侵入式其實不會有什麼副作用，自己做完頂多隔天會像運動完有點酸酸的不會到痛，而且效果不錯，堂線條就出來了,最近看到君綺的優惠價，預約去做了一堂，當下做覺得腹部很痠，回去痠了三天，感覺是突然做很多仰臥起坐的感覺，打算多買幾堂試試看能不能長出腹肌哈哈,,,,,,,,,,,,,,,,,,,,,,,,,,,,,,,,,,,,,,,,,,,,,,,,,,,,,,,,,,,,,,,,,,,,,,,,,,,,,,,,,,,,,,,,,,,,,,
我月給賴醫師抽手臂跟後背，很推喔。術,推賴醫師技術很好，威塑術後沒有凹凸不平，搭配超能電漿皮都沒有鬆建議冬天做比較好夏天很難持續穿著塑身衣,我待過的醫美群組也很多人不推賴，但是我本人自己就是給賴抽的我覺得很推啊,想知道的到底多氣派上次去覺得診所很高級欸,想問賴醫師補臀多少錢><也打算之後去資訊給賴抽腿去過也不覺得老舊啊哈哈想問大為何不推賴><,賴醫師很細心術前說明很詳細，個人覺得診所環境很不錯休息室的很好,推依心林子宇抽完非常平順馮的話有朋友做過效果也還不錯,推,我推亞緻，醫生超級親切、術後服務非常我推亞緻，醫生超級親切，術後服務也很好,請問賴是指女醫師嗎,真的不要賴,之前查馮好像有負評有人知道為什麼嗎想知道為什麼不推賴+,亞Ｘ有賴Ｘ毅（專任）與賴Ｘ薇（兼任,,,,,,,,,,,,,,,,,,,,,,,,,,,,,,,,,,,,,,,,,,,,,,,,,,,,,,,,,,,,,,,,,,,,,,,,,,,,,,,,,,,,,,,
也想去做眼袋手術可是想到要開刀就感覺好痛還在給自己心理建設,推錢逸群醫生我媽也是給他做眼袋內開只是我媽年紀大了皮膚比較鬆所以還有加切皮手術開完沒什麼疤痕而且看起來年輕很多他超開心的,眼袋手術不會痛，術後腫比較煩，要耐心等恢復,錢醫師還不錯人很親切、技術又好我除了眼袋內開還有把眼袋脂肪補到淚溝整個氣色差很多瘀青消腫差不多要等周，做完到現在年多了沒後遺症撐過恢復期就覺得很值得,楊醫生人超溫柔我手術做到現在很滿意，術後也有關心,想問樓上術後恢復期大概多久做完會有什麼後遺症嗎,我有陪我朋友去做眼袋手術手術差不多一個小時就好了我朋友說只有插麻醉針的時候比較痛其他沒什麼感覺欸,推,ㄧ定要全麻，真心推薦,如果只考慮這三位我是覺得可以都去問問,,,,,,,,,,,,,,,,,,,,,,,,,,,,,,,,,,,,,,,,,,,,,,,,,,,,,,,,,,,,,,,,,,,,,,,,,,,,,,,,,,,,,,,,,,
,,的眼頭更順，但眼尾有些過長下彎感，若也在意要問醫生可怎麼做。,喜歡,看起來有神很多,要開放還是封閉其實很看個人喜好耶我也前不久割的你可以搜我參考照片我原本比較偏封閉，做完是開放式，兩眼對稱+不要割太高就好看,,我喜歡開放式,你雙眼皮貼的那樣就很美了，開放式的讓你變成路人欸,推,一定是啊比較有神,就只是眼睛比原來的大，但會比較無神一,選,比較好看,推一個等後續,,,,,,,,,,,,,,,,,,,,,,,,,,,,,,,,,,,,,,,,,,,,,,,,,,,,,,,,,,,,,,,,,,,,,,,,,,,,,,,,,,,,,
許英哲醫生,游瑞欽醫師,台中大推美麗線的陳醫師我就是找他做的自體肋骨吸收率低鼻子挺度維持不錯,我也是給謝醫師做的很推,台中林雍球醫師，光評估就仔細到不行,郭醫師是在台北，我是找郭醫師隆鼻和墊下巴教主有在台中的是朱醫師，這兩位做鼻子都蠻厲害,謝東穎頻道好幾個男生隆鼻的影片如果追求自然的話很可以找他,雅丰的曾文尚也還不錯，我是給他做的，當初也是想要自然一點才去找他，而且醫生也會根據你的臉型五官調整，之前去評估幾家都很像在套模板,,,,,,,,,,,,,,,,,,,,,,,,,,,,,,,,,,,,,,,,,,,,,,,,,,,,,,,,,,,,,,,,,,,,,,,,,,,,,,,,,,,,,,,,,,,,
