comment_1,comment_2,comment_3,comment_4,comment_5,comment_6,comment_7,comment_8,comment_9,comment_10,comment_11,comment_12,comment_13,comment_14,comment_15,comment_16,comment_17,comment_18,comment_19,comment_20,comment_21,comment_22,comment_23,comment_24,comment_25,comment_26,comment_27,comment_28,comment_29,comment_30,comment_31,comment_32,comment_33,comment_34,comment_35,comment_36,comment_37,comment_38,comment_39,comment_40,comment_41,comment_42,comment_43,comment_44,comment_45,comment_46,comment_47,comment_48,comment_49,comment_50,comment_51,comment_52,comment_53,comment_54,comment_55,comment_56,comment_57,comment_58,comment_59,comment_60,comment_61,comment_62,comment_63,comment_64,comment_65,comment_66,comment_67,comment_68,comment_69,comment_70,comment_71,comment_72,comment_73,comment_74,comment_75,comment_76,comment_77,comment_78,comment_79,comment_80,comment_81,comment_82,comment_83,comment_84,comment_85,comment_86,comment_87,comment_88,comment_89,comment_90,comment_91,comment_92,comment_93,comment_94,comment_95,comment_96,comment_97,comment_98,comment_99,comment_100
三位醫師都諮詢過但個人比較喜歡吳孟穎的案例線條漂亮外也沒有凹凸不平的問題比價後也覺得是能接受的範圍,馮中呵,威塑滿推賴諮詢很仔細可以先找他談過之後再決定,賴釗毅醫師,真心推教主吳孟穎醫生諮詢的時候醫生很有耐心跟我討論超久掰掰肉跟大腿線條做超美,朋友在晶美陳啟傑做大腿環抽線條不錯看,啊啊啊樓上好生火我也一直在觀望很想做，但三四年過去了都沒付諸行動喔喔喔喔樓上這麼一說我更心動了,我推薦法喬邱醫師，有圖有真相超滿意,可以找周杰看看有在台北的樣子,朋友去做知美做抽脂效果很好診所裡面的設備看起來很強,葉佩某醫師，呵,我妹在極緻抽覺得醫師跟諮詢師都很親切也不錯專業,好像滿多朋友推教主的,為啥只有吳孟穎有把全名寫出來,這麼多人推各種醫師為什麼就只針對一家心動,給三位不同醫師抽過覺得劉厚耕抽得最仔細蠻推薦,推廖峻毅醫師,教主吳醫生很不錯針對我的地方有特別的做做完整個曲線超美,威塑不是應該找賴釗毅嗎,,,,,,,,,,,,,,,,,,,,,,,,,,,,,,,,,,,,,,,,,,,,,,,,,,,,,,,,,,,,,,,,,,,,,,,,,,,,,,,,,
元和雅,我自己給法ㄨ張醫師埋線，現在我在法ㄨ做的，法令變淡小臉我覺得效手機怪怪囧,法張醫師手術做得不錯推推,年初剛去前鎮的綻美埋線，醫生技術不錯對喔，開還沒很久，我朋友說是本來慈美的店長和院長自己出來開的，我那時候去剛開還有優惠，你可以問看看最近還有沒有便宜,綻美是新開的嗎,,,,,,,,,,,,,,,,,,,,,,,,,,,,,,,,,,,,,,,,,,,,,,,,,,,,,,,,,,,,,,,,,,,,,,,,,,,,,,,,,,,,,,,,,,,,,,,
可以去做看看鼻雕我自己就是玻尿酸打完就差不多消很快本人代謝比較好的關係做完鼻雕線條很美很不錯我是給教主醫美的王沁璋醫師做的,同問,不是有脂肪隆鼻半永久,同事在維格打覺得滿精緻你可以研究一下,推薦埋線隆鼻比玻尿酸微晶瓷更有挺度,醫美工作的朋友說微晶瓷打的好不會寬,在君綺打過，醫師細心技術好，且用鈍針打，商品也都確認後當場開,我也有去東方八千代滿推薦的,請問樓樓上，郭岱洋是找不到耶,深層注射才不會寬，但是很多醫師都不會,我之前到小林診所打也維持的很久，技術也很優,我打過瑞絲朗也可以撐快一年,選擇用鈍針的醫師我身邊一個給郭岱洋醫師做線雕，一個給楊仕安醫師打鼻子，都還不錯鈍針的手法加上一層層鋪疊上去，這種打法比較持久，過了一年再補打即可線雕的立體感也很夠啊啊啊抱歉應該是郭『綻』洋醫師另外樓樓上，鼻頭可以用耳軟骨喔大，只需山根的話就用肋骨囉,我喜歡去極緻醫美打,我打微晶瓷可以撐快一年但因人而異,微晶瓷風險高，以後想整型還要刮掉，長期打不如直接自體軟骨手術做一做,私我，要用復合方式作才不會寬,一直打不是會變寬嗎我之前也想打但怕越打越寬和失明什麼的也怕之後如果要隆鼻會不好清,千代田不錯,看過給李杰年打瑞絲朗的撐滿一年多,自體軟骨有多到可以隆整個鼻嗎還是只能墊山根只想山根高的會能用軟骨嗎大,千代田還不錯醫生很有耐心而且有美感,打過一次微晶瓷，一次過敏哈啾一個月山根又平了（美不到三個月，哭）,我是在微風八千代打的反而覺得第三個月是最好看的時候,,,,,,,,,,,,,,,,,,,,,,,,,,,,,,,,,,,,,,,,,,,,,,,,,,,,,,,,,,,,,,,,,,,,,,,,,,,,
台北我推小林，不推八千代，覺得有差,楊仕安黃政傑林上立,私信我,舒顏萃玻尿酸分開做哦,,,,,,,,,,,,,,,,,,,,,,,,,,,,,,,,,,,,,,,,,,,,,,,,,,,,,,,,,,,,,,,,,,,,,,,,,,,,,,,,,,,,,,,,,,,,,,,,
月去新聖給楊醫師縫，很滿意,我給割，周邊人都說很自然沒有肉條感`的很多面，有點出其他醫生沒說到的問題上面段字，諮詢時看的很多面,雙眼皮就是新聖沒有其他選擇,新聖真的強楊醫生要求完美到讓人很放,推陳建璋醫師,雙眼皮真的就是新聖最推，眼睛的手術價錢就不是首要考量點了，做壞很明顯,雙眼皮我推名單外的首爾醫美，之前一直想去韓國做雙眼皮但因為疫情去不了><在台北諮詢了好幾家終於找到有在做這種歐韓式的雙眼皮,推新聖+蕭有拍過雙眼皮介紹的影片可以去找一下記得那時候第一次聽到她的聲音有嚇到跟想像中不一樣,推儷人的鍾醫師他的技術很好而且手術完素眼的雙眼皮高度很自然,,,,,,,,,,,,,,,,,,,,,,,,,,,,,,,,,,,,,,,,,,,,,,,,,,,,,,,,,,,,,,,,,,,,,,,,,,,,,,,,,,,,,,,,,,,
然後老了變也好看,,,回樓上我還沒縫呀呀呀_新聖單縫，抽脂一邊回樓上的各位，我也是覺得會被吃，但好像又有點太寬平常的話因為工作關係必須上妝>_<請問壓力超大是什麼意思不懂今天剛縫完很滿意,,妳的眼線吃掉眼皮寬度，如果素顏會比較不自然，封閉式眼型比較適合妳,,新聖縫完加抽脂不痛只是壓力超大,你好漂亮請問醬縫要多少,看起來很好,,自然,,,我也給新聖逢的,你的眼睛跟我很像我也是楊醫師縫的我選沒後悔,,不要縫這樣比較好看,,,,你眉眼太近，不要割太高,,,,如果沒有眼線看起來就是開放式的了，如果平時都有習慣上妝，會比較適合。,,,縫完後可以上來告訴我們會不會痛ㄇ,我給楊醫師縫這種開放式評價不錯,更正*,,,,怕久了會掉太寬,,,,,,,,,,,,,,,,,,,,,,,,,,,,,,,,,,,,,,,,,,,,,,,,,,,,,,,,,,,,,,,,,
材質好,我也有在考慮看要哪種材質但我已經選好要去找謝宇軒醫師做二度隆鼻手術看他們案例二度隆鼻的都效果蠻好的,最近才在思考蘇醫師，隆鼻的醫生跟材料都思考了許久,諮詢過蘇醫師覺得人很好但諮詢師不,只要是手術都有併發症風險,最近也給許諮了二次重修開好想等你的心得看看,蘇醫師很推薦ㄟ我自己的朋友也都沒問題朋友做真皮也很美(不是蘇醫師的案例),我也預備二次打算選全覺得真皮效果太過自然了沒有很想要,,,,,,,,,,,,,,,,,,,,,,,,,,,,,,,,,,,,,,,,,,,,,,,,,,,,,,,,,,,,,,,,,,,,,,,,,,,,,,,,,,,,,,,,,,,,
我在立悅打的技術不錯,也要看你想打哪個部位吧，不同部位打的玻尿酸品牌也不同。,我們朋友們打鼻子有用水微晶、瑞斯朗、和喬亞登的，自然度都不錯(不要一直打就好)，另外醫師的美感和技術真的很重要,最近好像有一支新的不知道如何,我打淚溝到目前已經維持快兩年了，喬亞登的，很滿意,推台北三豐盧醫生技術很好，玻尿酸是喬雅登和瑞斯朗的，而且有直接在我面前拆封原廠包裝很安心。我比較喜歡自然感，覺得有找對醫師,淚溝怎麼能漏掉保柔緹,推瑞絲朗水膜針我朋友都找戴昌興,推林口蒔蘊時尚醫美皮膚科醫師開的醫美診所去打過玻尿酸效果不錯至於品牌我研究也不多可以直接問醫師差別,推立悅莊醫生，技術好、細心，也是當面拆,我自己的經驗是，太便宜的很快就消了要找專業的診所跟醫師比較重要,,,,,,,,,,,,,,,,,,,,,,,,,,,,,,,,,,,,,,,,,,,,,,,,,,,,,,,,,,,,,,,,,,,,,,,,,,,,,,,,,,,,,,,,,
可以找越診所黃醫師諮詢看看,女神玻尿酸是瑞絲朗的嗎也蠻想試試的,撐一年半蠻久的欸請問支撐度好嗎,我是在小林診所打的女神，也推薦給你,推薦黃千耀醫師，很專業,看同事打過女神真的蠻自然但她不在台北做的,鄭雅瑜黃千耀兩位都很細心，技術也不錯,,,,,,,,,,,,,,,,,,,,,,,,,,,,,,,,,,,,,,,,,,,,,,,,,,,,,,,,,,,,,,,,,,,,,,,,,,,,,,,,,,,,,,,,,,,,,
我也推廖家慶醫師重修很滿意,雙眼皮眼科的話推廖家慶醫師,,,,,,,,,,,,,,,,,,,,,,,,,,,,,,,,,,,,,,,,,,,,,,,,,,,,,,,,,,,,,,,,,,,,,,,,,,,,,,,,,,,,,,,,,,,,,,,,,,
推朱立箴醫師去諮詢看看,我諮詢了幾家後最後在台北蘇皇詮做了但還沒消腫完畢所以也不知道如何不過案例,陳振坤醫師,謝東穎醫師+我有寫過文章可以參考,我在蘇皇銓做的,謝宇軒醫師^_^,不推長蕭,推薦許英哲醫師他的技術跟美感是走在最前面的幾個人之一,推朱立箴不錯,推蘇很滿意,朋友在美麗新做完滿漂亮的，林鴻穎醫師,推謝東穎醫師,我也推薦謝東穎醫師ㄟ，鼻模擬還蠻精準的不過有點難預約可能要提早幾個月好奇原的口袋名單有誰,推薦許瑞賢醫師很自然,妳在哪個區域高雄許英哲台北許瑞賢星采邱大睿`,謝東穎,台中的美麗線，同學在那邊做的，好看又自然,之前有朋友去蒔蘊給謝宇軒做隆鼻還不錯鼻型自然而且診所環境不錯沒有推銷的氛圍,陳振坤醫師,,,,,,,,,,,,,,,,,,,,,,,,,,,,,,,,,,,,,,,,,,,,,,,,,,,,,,,,,,,,,,,,,,,,,,,,,,,,,,,,,
推君綺的陳振坤醫師我是用縫的已經年了還是很自然,我給縫當初醫生也有給我小切口抽脂的選項諮詢時都會模擬後來我覺得自己沒很泡就選,推爆黃耀立,、都有諮詢最後給做,請問新聖是手術時間難排而已還是預約也難排,璞之妍林醫師剛做完一個月路過,我剛去縫耶，當初也是猶豫和,你這個感覺要提眉才對餒,推陳承謙醫生雖然版上分享不多，但目前看到的都是好，我用割的也很自然,前陣子給荊提眼臉+逢感覺還可以如,推皇妍的蘇醫師縫完兩年,感覺好像沒有很拋不需要到抽脂的感覺大部分人都只做過其中之一的醫生很難比,可以參考極緻杜隆成醫生哦他在眼整形方面是權威,我是美睫師，因為多年前做過雙眼皮，所以特別注意做過雙眼皮的客人，覺得好看的自然的會請教醫師名字，記下來，如果有如果有客人想做，再請她自己去資詢。目前看過最自然好看的是荊偉政、黃耀立，，我自己則是車參聖（板上有些爭議，但但我是沒遇上什麼），給妳參考,璞之妍林醫師，我覺得讓人很放心的醫生當初荊醫生和林醫生我果斷選林,我最近也在猶豫該去還是，新聖好多人說可以撐很久,我在做提眼瞼肌跟割雙眼皮，沒有人看出,如果只有這幾個選擇，那必選,、評價都不錯雖然我在金台縫的,,,,,,,,,,,,,,,,,,,,,,,,,,,,,,,,,,,,,,,,,,,,,,,,,,,,,,,,,,,,,,,,,,,,,,,,,,,,,,,,,
,你可以撐的起,很適合你,覺得很好看,或，隨年紀眼皮會往下掉楊醫師粉絲,很好看,,,比較能修飾你的眼型,,眼睛大的可以像眼睛小的就不能了,,,,,號,,,喜歡,,-，感覺離眉毛太近,都可以,號,,也用完兩個月美到爆,,,,,,,,,,,,,,,,,,,,,,,,,,,,,,,,,,,,,,,,,,,,,,,,,,,,,,,,,,,,,,,,,,,,,,,,,,,
推樓上杜醫師的專業就是眼整形網路上口碑也不錯重修更要慎選醫師阿,原是去全美嗎,推薦高雄亮晶晶眼科，可以搜尋我分享文,台北杜隆成或高雄賴慶鴻,,,,,,,,,,,,,,,,,,,,,,,,,,,,,,,,,,,,,,,,,,,,,,,,,,,,,,,,,,,,,,,,,,,,,,,,,,,,,,,,,,,,,,,,,,,,,,,,
,,,開放式比較好,,然後原很適合畫韓系眼妝皮膚超好看,,朋友畫很美，硬要割選,我覺得,,好看，其他還好,很美,大眼睛就是要,哦,當然,其它的之後都會變不見,,,,,,,,,,,,,,,,,,,,,,,,,,,,,,,,,,,,,,,,,,,,,,,,,,,,,,,,,,,,,,,,,,,,,,,,,,,,,,,,,,,,
左旋乳酸只怕不夠，不太可能太胖,伊蓮絲有試過，但是好像沒什麼改善耶,同一樓要局部要不要試伊戀絲,,,,,,,,,,,,,,,,,,,,,,,,,,,,,,,,,,,,,,,,,,,,,,,,,,,,,,,,,,,,,,,,,,,,,,,,,,,,,,,,,,,,,,,,,,,,,,,,,
推朱立箴醫師我跟我朋友是找他用的,韋志曄我跟我姐妹鼻子都是他用的非常自然目前第年了有需要照片可以來信,有一種尋找價值股的概念,蘇皇銓謝東穎,韋志曄跟謝東穎的鼻型真的最精緻好看真心不騙,邱昱勳醫師,美塑館劉家瑋醫師，不算冷門但很值得推薦,林進達一點都不推把我鼻子做成鷹鉤鼻,謝東穎目前正在諮詢,許英哲,高全祥,林鴻穎,邱醫生不算冷門吧網上有很多業配文,推薦一下我的醫生，陳雍元，刀房的同事說他執刀都很細心,林鴻穎,張馨仁醫師、陳雍元醫師,我是找許瑞賢醫師，有需要照片可以站站內信給我,光彩時尚郭宏義院長夠冷門吧甯之美林進達醫師樓上聖宜倪宗聖醫生時尚黃定承院注群英陳大正醫師首爾蕭宏道院長越診所李`,蕭正偉醫師，專隆鼻重建和三度空間拉皮美妝部落客愛吉賽兒就是給蕭正偉醫師做蹷誚葉垂建,也想知道謝東穎都排到七月了,朋友給謝宇軒做過隆鼻是在桃園的診所當初是諮詢好幾家就這間不推銷態度也好鼻型也做的自然可以去試試看,結果都還是版上常出現的醫生,邱大睿,,,,,,,,,,,,,,,,,,,,,,,,,,,,,,,,,,,,,,,,,,,,,,,,,,,,,,,,,,,,,,,,,,,,,,,,,,,,,
應該是鈍針吧,粗針是什麼請問如何搜尋可看相關資訊,現在有可吸收的鈴鐺線了，塑立愛,我也想知道粗針是什麼,,,,,,,,,,,,,,,,,,,,,,,,,,,,,,,,,,,,,,,,,,,,,,,,,,,,,,,,,,,,,,,,,,,,,,,,,,,,,,,,,,,,,,,,,,,,,,,,
,,喜歡,有的不過是因為顯微的方式（）取脂,,,好看但怕掉下來,,,兩個都很美耶可能要看你化妝習慣決定,,我自己是喜歡感覺比較有質感,喜歡,請問醫師有建議要抽眼皮脂肪嗎,做個眼部抽諮商然後再去縫雙眼皮會比較漂亮千萬不要開眼頭我是去台北的車聖你一定要抽脂肪一定要抽脂肪知道嗎很重要說要說三次,,,我選的話感覺很快會掉下來,,,,,,,,,,,,,,,,,,,,,,,,,,,,,,,,,,,,,,,,,,,,,,,,,,,,,,,,,,,,,,,,,,,,,,,,,,,,,,,,,,
我在淘寶買了一條還不錯價格千初,,想知道＋,謝謝還有其他推薦的嗎,今天剛去買了瑪芮娜漢神巨蛋五樓有便宜又好穿,,,,,,,,,,,,,,,,,,,,,,,,,,,,,,,,,,,,,,,,,,,,,,,,,,,,,,,,,,,,,,,,,,,,,,,,,,,,,,,,,,,,,,,,,,,,,,,
我也覺得第三家的眼睛比較好看耶,推璞之的女醫師，很喜歡,也覺得第三家好看我跟你一樣拿的眼睛當範本,,,能縫就用縫的吧,新蕭醫師不需要等周圍的人去縫都超美我自己也是考,君院長陳振坤、去諮詢看看、技術很好、但就是價格比較高,覺得第三家模擬的眼型好看,照片來看是,我在儷人割的剛做完的確不腫，目前快四年眼頭的摺痕已經掉了很不明顯，最近想回去補救,第三家+,極緻杜醫師杜醫師做出來的摺線超美,我給割的，做出來的雙眼皮是我的菜,推荊醫師術後快一年了還是一樣好看,,,,,,,,,,,,,,,,,,,,,,,,,,,,,,,,,,,,,,,,,,,,,,,,,,,,,,,,,,,,,,,,,,,,,,,,,,,,,,,,,,,,,
微整形一定是比保養品什麼的都還要強上倍，但做完的前一周應該都是臉部會微腫然後有點痛,垮這件事我真心覺得醫美比保養品有用太多了或者有一個方法更容易不垮，妳吃胖就可以,我姐有去過靚優諮詢並做拉提推薦你`,我都找靚優的鄭醫生,十年前做過短短的那種膠原蛋白線那種就痛感很低感覺魚骨鈴鐺都很痛><但如果未來真的必須得要靠埋線，應該還是會鼓起勇氣吧，現在先用海芙鳳凰來維持有聽過從口內穿出的例子><,果妳要藍鑽魚骨線的話，我推薦鄭嘉琪醫師，她技術很好也很熱愛工作，上次做的效果很好恢復期很快,埋線-是我這輩子絕不會做第二次的麻醉+在埋的過程超級可怕,版主會爬到比較多藍鑽魚骨線的原因是它線的造型接近魚骨，可加強線材的拉力、張力，也可降低腫脹的狀況，所以現在比較夯,打麻醉超痛的剛埋完中下臉時吃東西都感覺臉頰在拉扯但當下效果不錯,埋線感覺是立即有效但不持久,多多少少都會痛吧希望是術後恢復期沒有很久，聽說會不太能咀嚼或是不太能說話一陣子,我以前是隔一段時間就做音波拉提、但我後來還是覺得埋線，我在靚優做的，其實術前術中都有做好止痛的話怕痛也沒甚麼問題術後恢復期沒有很久所以推推,感謝分享我去靚優真的很專業,爬文當然是各家醫美超多，現在器材都很厲害，只差在用心程度了我自己是都找評論最多的先諮詢再說，最後一樣是大家推的靚優鄭醫師，他們團隊很細心，會提醒很多事情跟關心，這個感覺就很好,台北真的是醫美重鎮，建議妳先從親朋好問起吧，妳也看不到我們做得好不好,醫美是條不歸路，我也去靚優做過，之前是去做玻尿酸打在唇上，下周是要去做埋線拉提，我可以做完跟妳分享,開價保養品就是那樣阿頂多只能維持不能修護真的醫美做一做比較快,看完這篇決定去靚優，目前已經埋線完，鄭醫師技術真的好又仔細，術後恢復期也沒想像中久，推,埋過兩次，第一次埋很淺，沒什麼效果覺得被騙，第二次去給群英張世幸做，用玫瑰線材，手法不一樣，嘴邊肉跟凹陷都有改善，一年多了還很緊，效果很好,我也觀望很久看了朋友去首爾埋完後半年確認效果很不錯才放心明天決定要去給李醫師埋線了,我朋友花了幾萬整形他說埋線最痛,條線只要兩分鐘就完成,真的嗎會不會術後也超痛哇感覺真的很痛但因為各大診所的案例拉提效果都很強還是想要去試試看那像什麼膠原蛋白線、跟大剛做完都是去哪間診所做的啊哈哈哈哈哈哈吃胖這個方法太好笑了,,,,,,,,,,,,,,,,,,,,,,,,,,,,,,,,,,,,,,,,,,,,,,,,,,,,,,,,,,,,,,,,,,,,,,,,,,,,,
我給賴醫師抽過大小腿超級滿意這個月底會去抽腹部,那請教賴醫生的自體技術如何呢,薛乃維真的抽的很好我跟我朋友都給他抽的、很平整,高雄美塑館劉家瑋他跟診所都有威塑認證抽得線條順補脂也很厲害,印象中有看過賴幫民雄做的腹肌，超強的，可是他很少露，上次上國智還以為他會秀,亞的賴是指賴釗毅他水管上滿多案例影片可以找的吧,診所是威塑認證的好像也很重要有認證的話使用機型就會是他們家的我當初就是憑這點和有第二代機型的去找後來去晶美諮詢才發現他們是的機器,同推黃志宏，威塑是他最早學習帶回來的,推周+,威塑認證可以辜狗威塑官網會有醫師名單,晶美諮詢報價好貴而且超硬不給殺,賴+,高雄的雅典娜劉院長也很專業,周杰,推群英黃志宏醫師有威塑證照案例多雕塑的線條很自然,威塑官網怎麼搜尋查不到,-,,,,,,,,,,,,,,,,,,,,,,,,,,,,,,,,,,,,,,,,,,,,,,,,,,,,,,,,,,,,,,,,,,,,,,,,,,,,,,,,,,,
,,我下星期要去諮詢,覺得的眼睛比較有神,,比較好看另外請問您知道目前手術排到幾月了嗎,,,,,,,,,,,,,,,,,,,,,,,,,,,,,,,,,,,,,,,,,,,,,,,,,,,,,,,,,,,,,,,,,,,,,,,,,,,,,,,,,,,,,,,,,,,,,,
好看,,我喜歡,最適合最多，眉眼距滿近不適合太高,覺得可考慮開眼頭欸,喜歡>>,，拉皮不錯,,回大了哦我也想要開眼頭可是他沒跟我報價是大才對不好意思拉皮跟雙眼皮價格差倍哦,請問拉皮價格多少謝謝,好看很像天生的,也想請問拉皮價格多少謝謝,請問五爪+雙眼皮費用是多少,,,,,,,,,,,,,,,,,,,,,,,,,,,,,,,,,,,,,,,,,,,,,,,,,,,,,,,,,,,,,,,,,,,,,,,,,,,,,,,,,,,,,,,
,好看,的眼型比較好看,，感覺比較適合你,,,比較自然,比較好看,比較好看我覺得近年來大家都追求開放式的雙眼皮不過不一定適合自己看過好多個割了開放式卸妝後不是那麼的自然我覺得還是選適合自己的比較好,我喜歡弄錯，才對,繼續用雙眼皮貼,,,,,,,,,,,,,,,,,,,,,,,,,,,,,,,,,,,,,,,,,,,,,,,,,,,,,,,,,,,,,,,,,,,,,,,,,,,,,,,,,,,,,,,,,
我在羅那裡看過健保的診，覺得不錯,小荳可以找許就好,請問美朵多少錢,想知道美朵價格+,我在美朵打肉毒咀嚼肌兩次效果不錯,請問羅的玻尿酸價位是多少呢,小荳我是打肉毒但是很快就恢復了覺得,推羅玻尿酸他們家是用喬雅登的,,,,,,,,,,,,,,,,,,,,,,,,,,,,,,,,,,,,,,,,,,,,,,,,,,,,,,,,,,,,,,,,,,,,,,,,,,,,,,,,,,,,,,,,,,,,
我下週要去找陳教授，好緊張,雷神,改天去幫你問問,陳教授是哪位,我有給陳教授跟小王子諮詢過，但最後還是選薛乃維醫師,技術上--當然是陳教授而且又是整型外科,陳教授值最高真心不騙,陳教授+有抽有效,雷神,陳教授是哪一位,當然是挑醫師和診所都有口碑的小王子而且雷溶效果明顯也比較安全,陳教授會抽臉跟下巴嗎,陳,陳教授是哪一位,,,,,,,,,,,,,,,,,,,,,,,,,,,,,,,,,,,,,,,,,,,,,,,,,,,,,,,,,,,,,,,,,,,,,,,,,,,,,,,,,,,,,,
,,我的眼睛較短所以看起來不大，就是圓圓的小雙眼皮，但我也沒有不喜歡，所以很掙扎><今天出門吃飯嘗試畫了眼線，雖然很手殘但感覺修煉一下眼妝技術好像就能改善眼長問題，謝謝大家的建議，我還是先把這筆錢省起來好了,我覺得不用動耶原本就很漂亮了,不用,自己喜不喜歡是重點覺得好看就別動了很美喔,,紅明顯，不要浪費錢我覺得這樣就很好看了,感覺不用動耶現在很自然很美,不要動，現在很美啊,，現在就很漂亮了啊,,,,,,,,,,,,,,,,,,,,,,,,,,,,,,,,,,,,,,,,,,,,,,,,,,,,,,,,,,,,,,,,,,,,,,,,,,,,,,,,,,,,,,,,,
樓笑死,我覺得還是要去諮詢看看耶自己是推廖峻毅醫生,雷神,米洛斯張醫師剛抽完兩週效果超超超超超超好,樓,卡一個,,,,,,,,,,,,,,,,,,,,,,,,,,,,,,,,,,,,,,,,,,,,,,,,,,,,,,,,,,,,,,,,,,,,,,,,,,,,,,,,,,,,,,,,,,,,,,
打不好才會垂，補脂肪很看醫生技術脂肪會垂基本上都是擺錯層次所致,我補過淚溝，不用一年，三個月就吸收光對了，我超瘦的,補過一次，一年吸收光光,補脂，補完好好照顧值很高,朋友有肉作自體我瘦作舒，都有效但我自己喜歡注射。方便又快速而且自然,自體補過淚溝蘋果肌全部吸收光,範圍大自體局部舒顏選對醫生,舒顏萃我覺得效果比較自然,比較喜歡補脂的效果我也是超瘦第一次補很快就沒了但第二次補存留意外地好,上半臉也會壓到眼皮吧對脂肪補臉這塊沒什麼信心,上半年脂肪，下半臉童顏針或少女針，脂肪不建議補下半臉容易垂,,,,,,,,,,,,,,,,,,,,,,,,,,,,,,,,,,,,,,,,,,,,,,,,,,,,,,,,,,,,,,,,,,,,,,,,,,,,,,,,,,,,,,,,,
眼袋手術蠻值得做的弄掉眼袋不管有沒有化妝都會很美變年輕我做完大概一週就恢復差不多了喔,我是做無痕眼袋，內開再補一點點脂肪在淚溝，看起來很有精神跟之前憔悴的樣子差很多要看你黑眼圈造成原因過敏色素累積淚溝凹都有可能造成黑眼圈眼袋手術可以改善淚溝凹的那種黑眼圈，可能要問醫生才能知道你是哪一種價錢應該每個人狀況不同會不一樣吧所以還是要給醫師看過才知道做之前問了很多家最後選了璞之妍，醫生諮詢態度讓人很放心，診所走高質感路線，我做完覺得很值得,台北可以查看看黃仁吳的五合一眼袋手術，如果你有黑眼圈、淚溝也都可以一起改善，因為是內開所以外面沒有傷口，隔天就可以上班,如果是眼袋+淚溝黑眼圈，可以眼袋內開補一點填充或脂肪,回大差蠻多的喔有點年紀的建議補脂晶華醫美徐典雄權威了,想問若沒補填充或脂肪效果會差很多嗎總,君綺廖峻毅ㄚ看到曹蘭也是給他做的很自然,,,,,,,,,,,,,,,,,,,,,,,,,,,,,,,,,,,,,,,,,,,,,,,,,,,,,,,,,,,,,,,,,,,,,,,,,,,,,,,,,,,,,,,,,,,,,
的許醫師專精鼻整形和重修可以諮詢柄,大佬的女兒算是優點連整形界都要看血統，長見識了我,重建推長庚主任蕭正偉,喜歡極緻林日新的作品（醫生我的菜）,慕顏韋醫師原是耳鼻喉科可以諮詢看看有,謝東穎韋都不錯不過個人最喜歡謝的鼻型,名門世家的意思吧我猜,樓的不同項目都一直推同間診所到底是想怎樣,我年前給郭菁松做有在版上分享過可以建議樓主先去諮詢,隆鼻重修應該找知美莊家榮知美本來就有做很多手術項目，我覺得他們做得很好啊,韋醫師好像有在做模擬鼻形也超精緻,賴昕隄醫師的鼻水作品都蠻好看@@人也很專業@@鼻子啦幹而且她是整外大佬賴春生的女兒之前有去諮詢過真的感受很好很細心樓上兩位，我的意思只是她很有名：）不用過度解讀^_^,,,,,,,,,,,,,,,,,,,,,,,,,,,,,,,,,,,,,,,,,,,,,,,,,,,,,,,,,,,,,,,,,,,,,,,,,,,,,,,,,,,,,,,,
